16;A friend of Jesus / Friendship with Jesus;C;"Welche Seligkeit ist nun mein Teil, 
denn Jesus ist mein Freund. 
Er schenkt mir Frieden, Freud' und Heil, 
bewahrt vor jedem Feind.
------------------------------------------------------------
A friend of Jesus, oh, what bliss,
That one so vile as I
Should ever have a friend like this
To lead me to the sky.

CHORUS
Freundschaft mit Jesus, 
dieses Glück ist mein!
O, die köstliche Gemeinschaft:
Er ist mein und ich bin Sein!
-------------------------------------------------------
Friendship with Jesus,
Fellowship divine,
Oh, what blessed, sweet communion,
Jesus is a friend of mine.

Wenn and're Freunde von mir geh'n, 
bleibt Er als Freund mir treu. 
Wenn andere mich nicht versteh'n, 
ist Seine Liebe neu.
----------------------------------------------------------
A friend when other friendship cease,
A friend when others fail,
A friend who gives me joy and peace,
A friend when foes assail.

Ein Freund, wenn Prüfung mich bedroht, 
ein Freund im dunklen Tal, 
ein Freund bei Schmerz und Todesnot. 
Er hilft mir überall.
----------------------------------------------------------
A friend when sickness lays me low,
A friend when death draws near,
Aa friend as through the vale I go,
A friend to help and cheer.

Ein Freund, wenn meines Lebens Lauf 
wird einst zu Ende sein. 
Dann nimmt Er mich im Himmel auf: 
Ich bin bei Ihm daheim.
------------------------------------------------------------
A friend when life's short race is o'er,
A friend when earth is past,
A friend to meet on heaven's shore,
A friend when home at last.";
51;A Passion For Thee;D;"Richte mein Herz, oh lieber Vater,
auf Dich allein. Lass mich nach
Deiner göttlichen Gegenwart
dürsten. HErr, richte meinen 
Schwerpunkt darauf, 
Dich allein zu lieben.
Reinige mich vom irdischen - 
wende mein Herz zu Dir.

CHORUS
Eine Leidenschaft für Dich, 
oh HErr, sende ein Feuer in
meine Seele und einen Durst
nach meinem Gott. Höre jetzt
mein Gebet, HErr, schenke 
Deine Kraft. Nicht allein um Dir
zu dienen, aber um Dich von 
ganzem Herzen zu lieben.

Vater füll mit Deinem Geist
und bereite mich zum Dienst zu.
Dass die Liebe für Christus jedes
Motiv beeinflusst. Hilf mir in selbst-
loser Unterordnung zu folgen. Sei
Du meine Freude und meiner Seele 
einzigstes Verlangen."
89;Abba Father / Abba Vater;G;"Abba, Vater Deine Lieb' nahm das Herz mir ein.
Ohne Deiner Nähe Licht kann ich nicht mehr sein.
Vater, hältst mich immer fest, lässt mich nie allein.
Dir vertrau' ich Tag für Tag, Vater, ich bin Dein.
-------------------------------------------------------------------
Abba Father, let me be Yours and Yours alone.
May my will forever be, evermore your own.
Never let my heart grow cold never let me go.
Abba Father, let me be Yours and Yours alone.";
164;All along on the road / Watching you, watching you;C;"Auf dem Weg, den du gehst,
wo dein Leben auch steht,
Gottes Aug` schaut nach dir.
Jeden Schritt, den du machst,
ob du schläfst oder wachst,
Gottes Aug` schaut nach dir.
---------------------------------------------------------------------
All along on the road to the soul's true abode,
There's an Eye watching you;
Eevery step that you take, 
This great Eye is awake,
There's an Eye watching you.

CHORUS
Schaut nach dir, schaut nach dir,
was du tief auch bewegst, Er ist hier.
Schaut nach dir, schaut nach dir,
ganz gewiss, Jesus Christ schaut nach dir.
---------------------------------------------------------------
Watching you, watching you,
Every day mind the course you pursue;
Watching you, watching you,
There's an all-seeing Eye watching you.

Wenn du Pläne noch hast
und du kommst nicht zur Rast,
Gottes Aug` schaut nach dir.
Gott wird warnen dein Herz,
wenn`s nicht geht himmelwärts,
Gottes Aug` schaut nach dir.
---------------------------------------------
As you make life's great flight,
Keep the pathway of right,
There's an Eye watching you;
God will warn not to go
In the path of the foe,
There's an Eye watching you.

Schau das Ziel freudig an,
das dein Herr kommen kann,
Gottes Aug` schaut nach dir.
Denk` im Leben daran, das nur Er retten kann,
Gottes Aug` schaut nach dir.
----------------------------------------------
Fix your mind on the goal,
That sweet home of the soul,
There's an Eye watching you;
Never turn from the way
To the kingdom of day,
There's an Eye watching you.";
174;All heaven declares / Forever He will be;G;"Der Himmel zeugt
von der Herrlichkeit des Herrn der Herrn.
Wer ist Ihm gleich
dem siegreich Auferstandenem?
------------------------------------------------------
All heaven declares
The glory of the risen Lord.
Who can compare
With the beauty of the Lord of Lords.

CHORUS
In Ewigkeit bist Du,
Erlöser, Herr, mein Gott.
Ich beuge meine Knie
und bet´ Dich an allein.
---------------------------------------------
Forever He will be
Redeemer, Lord, my God.
I gladly bend my knees
And worship Him alone.

Verkündet laut
die Herrlichkeit des Herrn der Herrn.
Er starb am Kreuz,
die Menschheit zu erlösen.
-------------------------------------------------
I will proclaim
The glory of the risen Lord.
Who once was slain
to reconcile men to God.";
217;Alles ist Dein und alles ist mein in Dir;G;"Alles ist Dein und alles ist mein in Dir. 
Dein ist die Macht,
ich rühm' Deine Kraft an mir. 
Ich bin Dein Kind,
ich preis Deine Lieb' für Christus,
der einst ans Kreuz für mich ging. 
Oh, Heiland, hab Dank,
in Dir bin ich reich gemacht.

CHORUS	
Halleluja, Halleluja,
Halleluja, ich bin ein Königskind! 
Halleluja, Halleluja,
Halleluja, ich bin ein Königskind!

Du bist der Herr
und Du bist der König ewiglich.
Sprich durch Dein Wort,
Dein Name ist süß, ich rühme Dich. 
Ich will Dich anschau'n in Ewigkeit,
die Herrlichkeit hältst Du für mich bereit.
Durch Deine Kraft wirst Du führen
Dein Volk zum Ziel.

In Dir ist Frieden,
in Dir ist Ruh für ewig da. 
Ich flieh' zu Dir, in Schwachheit 
und Not bist Du mir nah.
All meine Sorgen bring' ich zu Dir, 
und so bleibt ein tiefer Friede in mir. 
O, Vater, bewahr mich ewig
in Deinem Wort!";
383;As the deer panteth / Wie ein Hirsch lechzt;C;"Wie ein Hirsch lechzt nach frischem Wasser,
so sehn' ich mich, Herr, nach Dir.
Aus der Tiefe meines Herzens
bete ich Dich an, oh Herr.
-----------------------------------------------------
As the deer panteth for the water,
So my soul longeth after Thee.
You alone are my heart's desire,
And I long to worship Thee.

CHORUS
Du allein bist mir Kraft und Schild.
Von Dir allein sei mein Geist erfüllt.
Aus der Tiefe meines Herzens
bete ich Dich an, o, Herr.
-------------------------------------------------------
You alone are my strength, my shield;
To You alone may my spirit yield.
You alone are my heart's desire,
And I long to worship Thee.

Du, oh, Herr, bist mein Freund und Bruder,
Du mein König und mein Gott.
Dich begehre ich mehr als alles,
so viel mehr als höchstes Gut.
--------------------------------------------------------------
You're my friend and you are my brother,
Even though you are my King,
I love you more than any other,
So much more than anything.

Was bedeuten mir Gold und Silber,
Herr, nur Du kannst Erfüllung sein.
Du allein bist der Freudengeber,
wurdest mir zum hellen Schein.
-----------------------------------------------------
I want you more than gold and silver,
Only You can satisfy,
You alone are the real joy giver
And the apple of my eye.";
424;Auf Geschwister;;entfernt;
427;Aus Liebe Zu Gott;Ab / A;"Jesus ist der Erlöser,
Er hat uns von Sünde befreit.
Er hat Seine Liebe erwiesen,
Du kannst nun ein Kind Gottes sein.

CHORUS
Aus Liebe zu Gott, 
aus Liebe zu Gott:
Dein Herz übergib' Ihm,
lass Jesus einzieh'n!

Jesus ist der Erretter,
verlasse dich völlig auf Ihn.
Er hat deine Sorgen getragen,
du brauchst nur in Ihm zu ruh'n.";
488;Be glad in the Lord / Rejoice / O lasst uns mit;F;"O, lasst uns mit Jauchzen erheben 
den Schöpfer und Herrscher der Welt, 
den Herrn, von des Güte wir leben, 
des Allmacht uns trägt und erhält!
--------------------------------------------------
Be glad in the Lord and rejoice,
All ye that are upright in heart;
And ye that have made Him your choice,
Bid sadness and sorrow depart.

Chorus
Gelobt, sei Gott, 
gelobt sei der Herr, unser Heil!
Wir trau'n auf Ihn, 
Er ist unser Gut, unser Teil!
----------------------------------------
Rejoice, rejoice
Be glad in the Lord and rejoice;
Rejoice, rejoice,
Be glad in the Lord and rejoice

Denn Ihm gehört Himmel und Erde;
ja, Ihm ist kein anderer gleich.
Und wir sind das Volk Seiner Herde,
berufen, zu erben Sein Reich.
------------------------------------------
Be joyful, for He is the Lord,
On earth and in Heaven supreme;
He fashions and rules by His Word -
The 'Mighty' and 'Strong' to redeem.

Und hat Seine Hand uns geschlagen,
so hatte Er dennoch uns lieb.
Und gab es auch Lasten zu tragen,
die Hoffnung der Herrlichkeit blieb.
-------------------------------------------------
Though darkness surround you by day,
Your sky by the night be o'ercast,
Let nothing your spirit dismay,
But trust till the danger is past.

So lasst uns mit jubelnden Chören 
Ihm stets unser Loblied erneu'n. 
Preist Ihn, alle Welt soll es hören, 
dass wir uns'res Gottes uns freu'n.
--------------------------------------------------
Be glad in the Lord, and rejoice,
His praises proclaiming in song;
with Harp and with organ and voice
the loud Hallelujahs prolong!";
499;Be of good courage / Got any rivers you think are;G;"""Sei guten Mutes"", spricht Gott dort zu Josua,
heißt mit dem Volk durch den Jordan ihn geh`n.
Unmöglich scheint`s doch sie ziehen,
und Gott ist da, teilet die Fluten,
lässt Wunder gescheh`n.
---------------------------------------------------------------------------
""Be of good courage,"" God spoke unto Joshua, 
When o'er the river God pointed the way; 
Jordan uncrossable!
Things seemed impossible, 
Waters divide as they march and obey.

CHORUS
Schaust Du auf Ströme,
die keiner zu zwingen meint?
Stehst Du vor Bergen die niemand durchbricht?
Gott tut so gerne,
was uns ganz unmöglich scheint.
Er nur vollbringt es, ein andr`er nicht.
------------------------------------------------------------------
Got any rivers you think are uncrossable?
Got any mountains you can't tunnel through? 
God specializes in things thought impossible,
And He will do what no other pow'r can do.

Siege erringen wir ohne zu kämpfen nicht;
Jericho sperret dem Volke die Bahn.
Doch sie marschieren,
und Gott hält was Er verspricht;
Mauern zerbrechen, tritt Gott auf den Plan.
---------------------------------------------------------------------
Battles to win! They would meet with
Their obstacles, Jericho's walls, too,
Must fall to the ground. God never
Failed; He stood back of His promises,
Walls had to crumble as they marched around.

Gott ist derselbe, Sein Wort ist unwandelbar.
Er bahnt dir Wege im wogenden Meer.
Was wir nicht meistern,
Er wandelt es wunderbar,
Berge versetzen, das fällt Ihm nicht schwer.
---------------------------------------------------------------------
God is the same and His Word is dependable,
He'll make a way through the waters for you;
Life's situations by Him are amendable.
Mountains and hills He will part for you too.";
502;Be still and know / Seid still und erkennt;C;"Seid still und erkennt,
dass Ich bin Gott. (3x)
-----------------------------------
Be still and know
That I am God. (3x)

Ich bin der Herr,
dein Gott, der dich heilt. (3x)
---------------------------------------------
I am the God
That healeth Thee. (3x)

Auf Dich, o Herr,
vertraue ich. (3x)
----------------------------
In Thee, oh Lord,
I put my trust. (3x)";
506;Be still my soul/ Sei still mein Herz;Bb;"Sei still mein Herz, was immer dir geschieht.
Trag mit Geduld des Lebens Kreuz und Leid.
Gott ist ein Freund, der deine Drangsal sieht,
Er bleibt dir treu im Wandel dieser Zeit.
------------------------------------------------------------
Be still, my soul, Thy Lord is on thy side
Bear patiently, the cross of grief or pain.
Leave to thy God, to order and provide
In every change, He faithful will remain.

Sei still, mein Herz,
Gott schenkt dir Himmelsruh,
und alle Not
deckt Seine Liebe zu.
-------------------------------
Be still, my soul,
Thy best thy heavenly friend
Through thorny ways,
Leads to a joyful end.

Herr, Dir vertrau`, vertrau` ich ganz allein.
Herr, auf Dich bau`, Du lässt mich nie allein.
Ich geb mich Dir, ja, ganz vollkommen hin.
Sei still mein Herz.
-----------------------------------------------
In You I rest, in You I found my hope
In You I trust, You never let me go.
I place my life within Your hands alone
Be still, my soul.

Sei still, mein Herz, Gott Vater führt`s hinaus.
Er hält dich fest, wie Er`s bisher getan.
Sei nur getrost, bau` auf den Herrn dein Haus.
Und wirst du matt, du darfst zum Vater nah`n.
---------------------------------------------------------------
Be still, my soul, thy God doth undertake
To guide the future as He has the past
Thy hope, thy confidence, let nothing shake
All now mysterious shall be bright at last

Sei still, mein Herz,
es kann dir nur gescheh`n.
Was Gott der Herr
zum Heil dir auserseh`n.
-----------------------------------
Be still, my soul,
The waves and wind still know
His voice who ruled
Them while He dwelt below.

Herr, Dir vertrau`, vertrau` ich ganz allein.
Herr, auf Dich bau`, Du lässt mich nie allein.
Ich geb mich Dir, ja, ganz vollkommen hin.
Sei still mein Herz.
-----------------------------------------------
In You I rest, in You I found my hope
In You I trust, You never let me go.
I place my life within Your hands alone
Be still, my soul.

Sei still, mein Herz, bald kommt der Freudentag.
Der Heiland holt uns Heim zur Herrlichkeit.
Und alle Not, Enttäuschung, Furcht und Plag`
Hat dann ein End für alle Ewigkeit.
---------------------------------------------------------------
Be still, my soul, the hour is hastening on
When we shall be forever with the Lord.
When disappointment, grief and fear are gone,
Sorrow forgot, love's purest joys restored.

Sei still, mein Herz, und bete dankbar an.
Herr, Du mein Gott,
dass ich Dich fassen kann.
-------------------------------------
Be still, my soul,
When change and tears are past
All safe and blessed,
We shall meet at last.

Herr, Dir vertrau`, vertrau` ich ganz allein.
Herr, auf Dich bau`, Du lässt mich nie allein.
Ich geb mich Dir, ja, ganz vollkommen hin.
Sei still mein Herz.
-----------------------------------------------
In You I rest, in You I found my hope
In You I trust, You never let me go.
I place my life within Your hands alone
Be still, my soul.";
610;Bist Du Bereit Wenn Christus Erscheint?;F;entfernt;
611;Bist Du Bereit Zu Der Stunde;A;entfernt;
706;Bring them in / Bringt sie heim / Bringt sie rein;F;"Bringt sie heim, bringt sie heim!
Bringt sie heim vom Land der Sünd' und Pein!
Bringt sie heim, bringt sie heim!
Bringt die Kleinen heut zu Jesus!
--------------------------------------------------------------
Bring them in, bring them in,
Bring them in from the fields of sin;
Bring them in, bring them in,
Bring the little ones to Jesus.";
835;Change my heart oh God / Wandle Du mein Herz;C;"Wandle Du mein Herz,
mach es neu, o Gott.
Wandle Du mein Herz,
mach‘ es wahr und rein. (2x)
--------------------------------------
Change my heart, oh God,
Make it ever true,
Change my heart, oh God,
May I be like You. (2x)

Du bist der Töpfer, 
ich bin der Ton,
forme, o Herr, mich 
Dir zum Ebenbild.
------------------------------
You are the Potter, 
I am the clay,
Mould me and make me 
This is what I pray.

Wandle Du mein Herz,
mach es neu, o Gott.
Wandle du mein Herz,
mach‘ es wahr und rein.
--------------------------------------
Change my heart, oh God,
Make it ever true,
Change my heart, oh God,
May I be like You.";
905;Christus hält mich fest;;"Wenn mein Glaube schwinden will,
hält mich Christus fest.
Satans List wird mir zu viel,
Christus hält mich fest.
Alleine kann ich nicht bestehn
auf dem Lebensweg.
Alleine müsste ich vergehn,
Christus hält mich fest.

CHORUS
Christus hält mich fest.
Christus hält mich fest.
Mein Erlöser liebt mich sehr,
Christus hält mich fest.

Jesus nimmt den Sünder an;
Christus hält mich fest.
Keine Macht mich trennen kann;
Christus hält mich fest.
Meine Seele bleibt bewahrt,
Sein Versprechen gilt.
Denn Er hat den Preis bezahlt;
Christus hält mich fest.

Für mich ging Er in den Tod;
Christus hält mich fest.
Jetzt steh ich gerecht vor Gott,
Christus hält mich fest.
Mit Ihm werd ich auferstehn,
Christus hält mich fest.
Ihn mit eignen Augen sehn,
Wenn er wiederkommt.";
952;Come Holy Spirit / Komm Heilger Geist;D;"Komm, Heil'ger Geist, ich brauch' Dich. 
Komm, Heil'ger Geist, ist mein Gebet.
Komm zu Deinem Worte, es wartet auf Dich.
Komm in Fülle und Kraft.
------------------------------------------------------
Come Holy Spirit, I need Thee,
Come, Holy Spirit, I pray. 
Come in Thy strength and Thy power,
Come in Thine own special way.";
978;Come ye sinners / And I know / Kommt ihr Menschen;D;"Kommt ihr Menschen, ohne Hoffnung,
Jesu Blut befreit auch dich.
Rettet gern die Allerschlimmsten,
einen solchen, gleich wie mich.
-------------------------------------------------------
Come, ye sinners, lost and hopeless,
Jesus Blood can make you free;
For He saved the worst among you,
When He saved a wretch like me.

CHORUS
Und ich weiß (es ganz genau),
Ja ich weiß (es ganz genau),
Jesu Blut das wäscht
den schlimmsten Sünder rein. (2x)
---------------------------------------------
And I know (I surely know), 
Yes I know (I surely know),
Jesus Blood can make the 
Vilest sinner clean. (2x)

Und dem Schwachen gibt Er Stärke,
deine Berge, reißt Er ein;
findet Wasser in der Wüste,
Kehrt die Nacht in Sonnenschein.
----------------------------------------------------
To the faint He giveth power,
Through the mountains makes a way;
Findeth water in the desert,
Turns the night to golden day.

In Versuchung, ist Er bei dir,
dunkle Mächte hält Er fern,
führt dich sicher auf dem Wege,
gibt dir Gnade, täglich gern.
----------------------------------------------
In temptation He is near thee,
Holds the powers of hell at bay;
Guides you to the path of safety,
Gives you grace for every day.

Durch alle Zeit wird Er dich schützen,
bringt dich durch zur Ewigkeit.
Bebt die Erde, tobt die Hölle,
doch Er führt, zur Herrlichkeit.
---------------------------------------------------
He will keep thee while the ages
Roll throughout eternity;
Though earth hinders and hell rages,
All must work for good to Thee.";
1086;Das große Erbteil ich bald empfange;G;"Das große Erbteil ich bald empfange,
wenn auch auf Erden ich nichts bedeut',
Trotz schwerer Zeiten, bin ich nicht bange,
bald holt mich Jesus zur Herrlichkeit.

Chorus
Ja was macht das aus,
wenn die Menschen sagen,
dass wir so arm sind und and'res mehr?
Wenn wir im Himmel das Erbteil haben,
dann sind wir mehr als ein Millionär.

Wer überwindet, wird alles erben,
so spricht die Bibel, was will ich mehr?
Wir dürfen leben, wenn wir auch sterben,
wir haben mehr als ein Millionär.

Solch Glück und Reichtum
wir hier schon preisen,
wer kann uns schätzen, wie reich wir sind?
Die Lebenskrone ist mir verheissen,
Ich bin durch Christus ein Gotteskind.

Am anderen Strande wir dürfen gehen,
befreit vom irdischen Spott und Hohn.
Auf gold'nen Gassen wir singend stehen,
vor'm Lamme dort auf dem Gottesthron.

So woll'n wir fröhlich nach Zion eilen,
Wenn auch die Welt uns verachtet sehr,
und Freud und Leid miteinander teilen,
Wir sind ja mehr als ein Millionär.";
1087;Das wird allein Herrlichkeit sein;G;"Wenn nach der Erde Leid, Arbeit und Pein
ich in die goldenen Gassen zieh ein,
wird nur das Schau'n meines Heilands allein
Grund meiner Freude und Anbetung sein.

CHORUS
Das wird allein Herrlichkeit sein,
das wird allein Herrlichkeit sein,
wenn frei von Weh' ich Sein Angesicht seh',
wenn frei von Weh' ich Sein Angesicht seh'.

Wenn dann die Gnade, mit der ich geliebt,
dort eine Wohnung im Himmel mir gibt,
wird doch nur Jesus und Jesus allein
Grund meiner Freude und Anbetung sein.

Dort vor dem Throne im himmlischen Land
treff ich die Freunde, die hier ich gekannt,
dennoch wird Jesus und Jesus allein
Gund meiner Freude und Anbetung sein.";
1125;Denn Wer Ist Gott;Dm;entfernt;
1147;Die Güte des Herrn;D;"Die Güte des Herrn 
hat kein Ende, kein Ende.
Sein Erbarmen 
höret niemals auf.
Es ist neu jeden Morgen, 
neu jeden Morgen.
Groß ist Deine Treue, o Herr,
Groß ist Deine Treue, Herr.";
1232;Du bist ein wunderbarer Gott;;entfernt;
1233;Du hast dich mir geoffenbart;F;"Du hast Dich mir geoffenbart, 
oh, Herr, in großer Huld;
Du trägst als Hirte mich so zart
mit liebender Geduld.

Chorus
Drum bete ich Dich an,
mein Gott, ich bete an.
Aus tiefstem Herzen,
wie ich kann,
bet' ich Dich, Jesus, an.

Du bist der gute Hirte mir;
am Kreuz hast Du's bewährt. 
Herr Jesus, ich gehöre Dir, 
Du seist allein geehrt!

Herr, lass mich nur Dein 
Schäflein sein,
halt mich in Deiner Hut.
Ach, führe Du mich aus und ein,
dann habe ich es gut.

Du hast mich je und je gepflegt
mit sanftem Liebessinn;
drum ist mir's tief ins Herz gelegt,
was ich Dir schuldig bin.

Kein eig'ner Weg und Wille mehr!
Bestimme Du allein!
Ich gebe mich Dir gänzlich her;
mein alles sollst Du sein!";
1235;Du warst würdig um zu nehmen das Buch;D;"Du warst würdig 
um zu nehmen das Buch
und die Siegel aufzutun.
Hast mit Deinem teuren Blut erkauft
aus jedem Volk, 
Nation und jedem Land.

CHORUS
Halleluja, Halleluja, 
bin erkauft durch Jesu Blut.
Halleluja, Halleluja, 
bin erkauft durch Jesu Blut.";
1266;Ein Mann Am Kreuze;D;entfernt;
1267;Ein wunderbarer Name hier auf Erden;C;"Ein wunderbarer Name
hier auf Erden
erfüllt mit Freud'
mein Herz und meinen Sinn.
Wohl kann ich deshalb
missverstanden werden,
und doch durch Ihn
ich mehr als glücklich bin.

Chorus
Er ist so wunderbar,
der Name Jesus,
klingt süßer als
die schönste Melodie.
In Ihm ist Heil und völlige Erlösung,
Er schenkt mir Frieden,
Ruh und Harmonie.

Er ist ein Name
über alle Namen,
in Ihm ist alles
uns geschenkt von Gott,
in Ihm hat Gottes Wort
Sein Ja und Amen,
in Ihm ist Sieg
im Leben und im Tod.

Er bringt mir Trost
in schweren Prüfungsstunden,
wenn's dunkel wird
und alles wankt und bricht.
Ja, wenn es scheint
als gehe alles unter,
schenkt Er auf's neu
mir Mut und Zuversicht.

Sein Ruhm ist groß
und mehr noch wird Er finden,
bald legt mit Macht
Er alles unter sich.
Und wenn einst andre
große Namen schwinden,
dann strahlt der Name Jesus ewiglich.";
1327;Er hat mich so geliebt;C;entfernt;
1328;Er starb für dich;F;"Er starb für Dich,
Er starb für mich,
auf Golgatha.
Er starb für Dich,
Er starb für mich,
Halleluja.

Seine Hand zog heraus
mich aus Sünde,
Seine Hand zog heraus
mich aus Not.
Seine Hand voller
Liebe für Blinde
führt mich liebend
nach Hause zu Gott.

Er starb für Dich,
Er starb für mich,
auf Golgatha.
Er starb für Dich,
Er starb für mich,
Halleluja.

Diese Hand ward
geschlagen ans Kreuze,
diese Hand ward
durchstochen für mich.
Diese Hand musste
leiden die Qualen,
dass ich singen darf
nun ewiglich.

Er starb für Dich,
Er starb für mich,
auf Golgatha.
Er starb für Dich,
Er starb für mich,
Halleluja.

Diese Hand mit den
Malen der Nägel,
streckt sich liebend
nach dir heute aus.
Nimm die rettende
Hand deines Heilands,
diese Hand führt dich
sicher nach Haus.";
1330;Es gibt eine Heimat im himmlichen Licht;D;"Es gibt eine Heimat
im himmlischen Licht,
bereitet vom Heilande mein.
Und wenn Er mich rufet,
so weiß ich gewiss:
Ich werde kein Fremdling dort sein.

Chorus
O nein,
denn ich kenne den Heiland so gut,
Er ist ja auf Erden schon mein.
Und geh' in den Himmel ich ein
durch Sein Blut,
so werd' ich kein Fremdling dort sein.

Ich weiß, ob auch Menschen
mich selten versteh'n,
ob Freunde mich lassen allein,
wenn meinen Erlöser
ich droben werd' seh'n,
so werd' ich kein Fremdling dort sein.

Dort sind meine Lieben
am goldenen Strand,
umflossen vom himmlischen Schein.
Mit ihnen dort
wandle auch ich Hand in Hand.
Ich werde kein Fremdling dort sein.

O, Fremdling,
beim Heilande findest du Ruh',
Er wäschet von Sünde dich rein!
Komm heute zu Ihm,
und dann singest auch du:
Ich werde kein Fremdling dort sein.";
1331;Es gibt jemand der deine Lasten kennt;G;"Es gibt Jemand, der deine Lasten kennt,
Jemand, der dich Sein Kind nennt,
Jemand, der nie dich lässt allein.
Denn Er trug am Kreuze deine Last,
die du selbst getragen hast,
und Er wird immer bei dir sein.

Es ist Jesus, der deine Lasten kennt,
Jesus, der dich Sein Kind nennt,
Jesus, der nie dich lässt allein.
Denn Er trug am Kreuze deine Last,
die du selbst getragen hast,
und Er wird immer bei dir sein.";
1332;Es ist 'was gescheh'n, ich kann's nicht verstehn;C;"Es ist etwas gescheh'n,
ich kann's nun versteh´n: ein Wunder.
Ich sehe an mir das Leben aus Dir,
ein Wunder.
Es ist mir als hätt' ich den Himmel in mir,
ein Wunder. Was nie ich gedacht,
geschah über Nacht, ein Wunder.

Herr, Du bist mir nah,
weil etwas geschah, ein Wunder.
Denn Du liebst mich sehr,
was will ich noch mehr, ein Wunder.
Es ist mir als hätt' ich den Himmel in mir,
ein Wunder. Du hast über Nacht
ein Feuer entfacht, ein Wunder.

Jetzt leb' ich in Dir,
und Du lebst in mir, ein Wunder.
Das Alte verging, an dem ich so hing,
ein Wunder.
Es ist mir als hätt' ich den Himmel in mir,
ein Wunder. Was nie ich gedacht,
Du hast es vollbracht, ein Wunder.

Nun sprichst Du durch mich,
zu verherrlichen Dich, ein Wunder.
Die Menschen dann seh'n,
Dich auf Erden geh'n, ein Wunder.
Ich weiss es, es ist nun der Himmel in mir,
ein Wunder. Dein Wort hat's gesagt,
Du hast's offenbart, ein Wunder.";
1333;Es ist einer gekommen zu sterben für mich;D;entfernt;
1334;Es quillt für mich dies teure Blut;D;entfernt;
1335;Es steht ein Leuchtturm;C;entfernt;
