7304;Some golden daybreak / Glorreicher Morgen;F;"Glorreicher Morgen, wenn Er erscheint
und all die Seinen mit Sich vereint,
wenn aus den Himmeln Sein Ruf erschallt!
Glorreicher Morgen, der Herr kommt bald!
------------------------------------------------------------------
Some golden daybreak, Jesus will come;
Some golden daybreak, battles all won,
He'll shout the victory, break through the blue,
Some golden daybreak, for me, for you.";
7337;Sonnenschein der Gnade strahlet;G;"Sonnenschein der Gnade strahlet
täglich in dem Herzen mein,
Denn wo Jesu Liebe leuchtet, 
kann es nicht mehr dunkel sein."
7343;Sorge die Kreuzespredigt;;"Sorge, dass die Kreuzespredigt
möchte klingen an dein Herz,
dass du endlich wirst entledigt
von der Sünde Macht und Schmerz!
Lass dich doch von Jesu ziehen,
der allein dein Herz beglückt,
eile, Lüsten zu entfliehen,
deren Lockung dich berückt.

Willst du denn die besten ird'schem
Tand und Elend weihn,
um dereinst im Silberhaare
Gott um Gnade anzuschrein?
Wehe dir, du wirst betrogen,
ach, wie bald kommt dir dein Grab;
Tag für Tag wirst du gezogen
in die Sünde tief hinab.

Bringt das Alter etwa Tugend?
Machen denn die Jahre fromm?
Armes Herz in deiner Jugend komm zu Jesu,
komm, o komm!
Wenig hat der Greis zu hoffen.
Wie sein Leben er verbracht,
so wird er vom Tod getroffen,
oftmals, eh er es gedacht.

Hörst du nicht die Glocken läuten,
wie sie mahnen an den Tod?
Sprich, was wollen sie dir deuten?
Sie erinnern: ""Eins ist not.""
Eile, zeitig dich zu retten,
diese Stunde ist noch dein.
Fliehe aus den Sündenketten,
ehe es zu spät wird sein!

Jesus lebt. Er ruft mit Sehnen dich,
weil Er so warm dich liebt.
Geh zu Ihm mit Reuetränen,
hast du Ihn doch sehr betrübt.
Sieh, du hast Ihm fern gestanden
deine ganze Lebenszeit,
hast gelebt in Sündenbanden,
hast der Welt dein Herz geweiht.

Doch mit ernstem Liebeswerben
hat Er immer dein gedacht.
Ja, Sein Leiden und Sein Sterben
hat Er auch für dich vollbracht.
Alles will Er dir vergeben,
wirf dich nur an Seine Brust!
Da ist Friede, da ist Leben,
wahres Glück und Himmelslust!"
7359;Sowing in the morning / Bringing in the sheaves;A;"Seit so vielen Jahren säen Menschen Samen,
ja das Wort des Herrn, so kostbar und so fein.
Bald schon ist die Ernte, bald schon wirst du hören,
wie es oben tönet: ""Bringt die Garben ein!""
--------------------------------------------------------------------
Sowing in the morning, sowing seeds of kindness, 
Sowing in the noontide and the dewy eve; 
Waiting for the harvest and the time of reaping, 
We shall come rejoicing, bringing in the sheaves.

Chorus
Bringt die Garben ein,
bringt die Garben ein,
o welch eine Freude,
bringt die Garben ein!    (2x)
----------------------------------------
Bringing in the sheaves,
Bringing in the sheaves,
We shall come rejoicing,
Bringing in the sheaves!    (2x)

Hast du schon vernommen, Abend ist
gekommen und der Engel schwor, dass Zeit wird
nicht mehr sein. Viel wird nicht mehr fehlen,
nur noch ein paar Seelen,
bis der Meister rufet: ""Bringt die Garben ein!""
---------------------------------------------------------------------
Sowing in the sunshine, sowing in the shadows, 
Fearing neither clouds nor winter's chilling breeze; 
By and by the harvest and the labour ended, 
We shall come rejoicing, bringing in the sheaves.

Herr, ich kann es sehen, etwas wird geschehen,
Herr, ich bete, mach mich vor Dir klar und rein.
Ich will Dich nicht lassen, will Dich nicht verpassen,
ich will selber hören: ""Bringt die Garben ein!""
-----------------------------------------------------------------------
Going forth with weeping, sowing for the Master, 
Though the loss sustained, our spirit often grieves; 
When our weeping's over, He will bid us welcome, 
We shall come rejoicing, bringing in the sheaves.";
7417;Stehend auf dem Wort des Königs;A;"Stehend auf dem Wort des Königs 
Jesus Christ, der in Ewigkeit 
des Preises würdig ist, rühm' ich Ihn, 
der mich befreit aus Satans List, 
denn ich trau' dem Worte meines HErrn.

CHORUS
Gläubig steh' ich auf dem Worte
meines Heilands Jesus Christus.
Gläubig steh' ich auf dem Worte
meines Heilands Jesus Christ.

Fest trau' ich dem Wort des HErrn, 
das nimmer weicht, 
wenn in Not mich Zweifel oft 
und Furcht beschleicht. 
Doch durchs Wort des HErrn 
wird mir der Sieg so leicht, 
drum trau' ich dem Worte meines HErrn.

Steh' ich auf dem Worte, 
lässt der Geist mich seh'n, 
welch ein völl'ges Rettungswerk 
am Kreuz gescheh'n, 
kann nun in der Freiheit 
meines HErrn besteh'n, 
ruhend auf dem Worte meines HErrn.

Trauend auf dem Wort des Königs, 
fall' ich nicht, 
wenn ich stetig achte 
auf des Geistes Licht. 
Denn ich ruh' in dem, 
was mir Sein Mund verspricht. 
Fest trau' ich dem Worte meines HErrn."
7423;Stern Auf Den Ich Schaue;;"Stern auf den ich schaue,
Fels, auf dem ich steh,
Herr, dem ich vertraue,
Stab, an dem ich geh,
Brot, von dem ich lebe,
Quell, an dem ich ruh,
Ziel, das ich erstrebe,
alles, Herr, bist Du!
Ziel, das ich erstrebe,
alles, Herr, bist Du!

Ohne Dich, wo käme
Kraft und Mut mir her,
ohne Dich, wer nähme
meine Bürde, wer?
Ohne Dich zerstieben,
würde mir im Nuh,
Glauben, Hoffen, Lieben,
alles, Herr, bist Du.
Glauben, Hoffen, Lieben,
alles, Herr, bist Du.

Drum, so will ich wallen,
meinen Pfad dahin,
bis Posaunen schallen,
und daheim ich bin.
Dann, mit neuem Singen,
jauchz` ich froh Dir zu:
Nichts hab` ich zu bringen,
alles, Herr, bist Du!
Nichts hab` ich zu bringen,
alles, Herr, bist Du!"
7425;Still Anbetend Herr;;"Still anbetend, Herr, zu Deinen Füßen
Blicke ich zu Deinem Kreuz empor;
Sehe Deiner heilgen Augen Grüßen,
seh das Blut aus Deinen Wunden fließen,
und mein Dank quillt brennend heiß hervor.

Ja, für mich gabst Du Dein teures Leben, 
trugst die Strafe, Herr, für meine Schuld.
Ach, was konnte ich zum Lohn Dir geben?
Hatte gar nichts als mein sündges Leben, 
das Du sahst mit Schmerzen und Geduld.

Und Du sprachst:""O gib mir deine Sünde,
du bist mein, ich hab erlöst auch dich!
Und ich kam und durfte Frieden finden,
darf nun glaubend durch Dich überwinden,
wo so lang der Feind gefesselt mich.

Doch Dein Segen war noch nicht zu Ende,
mehr noch für Dein Kind, Herr, hattest Du.
Zu Dir streckt ich meine Glaubenshände, 
dass ich auch in Dir, mein Heiland, 
fände neues Leben, selge Glaubensruh.

Und die Fülle sandtest Du hernieder, 
tauftest mich mit Feuer, Kraft und Geist;
neue Zungen, heilge neue Lieder 
klingen nun in meinem Herzen wider.
Jauchzend meine Seele Dich lobpreist.

Halleluja! 
Welche Segensfülle hast Du, Heiland
Noch für mich bereit!
In Dir ruht mein Leben und mein Wille,
in dem Herzen wohnet heilge Stille.
Halleluja Dir in Ewigkeit!"
7429;Stille halten;;"Stille halten Deinem Walten, 
stille halten Deiner Zucht,
Deiner Liebe stille halten, 
die von je mein Heil gesucht:
Ja, das will ich, wie´s auch geh,
wenn´s dem Herzen auch tut weh.

Stille halten ohne Klage,
ohne Murren, ohne Trotz,
was dazu die Welt auch sage!
Ich will spotten ihres Spotts;
weiß ich doch, wie gut mir war,
stillehalten immerdar.

Wo ich´s selber wollte zwingen 
und es wagen ohne Dich,
ach, da sanken mir die Schwingen
meines Mutes jämmerlich, 
aber wo ich stille hielt,
hast Du stets mein Heil erzielt.

Ward es anders auch gewendet,
ging´s durch manches Dunkel oft,
immer hat es gut geendet, 
besser, als ich´s je gehofft,
besser als bei Tag und Nacht
ich´s im Herzen ausgedacht.

Darum will ich stille halten
Tag und Nacht, jahrein, jahraus,
bricht auch neues zu dem alten
Kreuz und Leid herein ins Haus.
Weiß ich nur, dass Du bei mir!
Stille halten will ich Dir."
7443;Strebend zu wandeln;C;"Strebend zu wandeln 
des Heilandes Pfade, 
trachtend zu folgen, wo immer Er führt; 
nach Seinem Vorbild das Leben gestaltend, 
singen wir fröhlich, weil Er uns regiert!

CHORUS
Wie schön ist es, 
zu geh'n an des Heilandes Seite,
wandelnd in dem Licht, 
wandelnd in dem Licht!
Wie schön ist es, 
zu geh'n an des Heilandes Seite,
wandelnd in dem Licht!

Will die Versuchung uns schnöde verleiten, 
lehnen wir fester dem Führer uns an. 
Sicher im Schutz Seines 
mächtigen Armes stimmen wir mutig 
ein Jubellied an!

Schreitend auf Pfaden 
der kindlichen Demut, 
Pfaden der innigen Liebe und Treu'; 
harrend der Gnade, 
die Er uns verheißen, 
singen wir immer und wieder auf's Neu'!

Strebend dem himmlischen Ziele 
entgegen, wo uns die Krone zum Lohne bereit. 
Dort wird zum Schauen, was hier wir geglaubet,
jubelnd und jauchzend in ewiger Freud'!"
7461;Suchst vergebens du Glück, Zufriedenheit;G;"Suchst vergebens du Glück, Zufriedenheit,
hat nicht oft schon enttäuscht dich dein
bester Freund.
Hör' wie Jesus dann leise zu dir spricht:
Meine Liebe reicht aus auch für Dich!

Meine Liebe reicht aus auch für dich,
Jesus, dein Herr, zu dir spricht.
Denn Mein Wort ist wahr,
Ich bin stets dir nah,
Meine Liebe reicht aus auch für dich.

Ist die Last oft schwer 
und du kannst nicht mehr,
versinkt dein Lebensmut in der Sorge Meer.
Hör' wie Jesus dann leise zu dir spricht:
Meine Kraft reicht aus auch für Dich!

Meine Kraft reicht aus auch für dich,
Jesus, dein Herr, zu dir spricht.
Denn Mein Wort ist wahr,
Ich bin stets dir nah,
Meine Kraft reicht aus auch für dich.

Hast du oft versagt und den Herrn betrübt,
und du fragst, 
ob Er dich auch jetzt noch liebt.
Hör' wie Jesus dann leise zu dir spricht:
Meine Gnade reicht aus auch für Dich!

Meine Gnade reicht aus auch für dich,
Jesus, dein Herr, zu dir spricht.
Denn Mein Wort ist wahr,
Ich bin stets dir nah,
Meine Gnade reicht aus auch für dich.";
7481;Surely goodness and mercy / Seine Güte und Gnade;C;"Seine Güte und Gnade und Seine große Treu'
werden folgen mir mein Leben lang.
Seine Güte und Gnade und Seine große Treu'
werden folgen mir mein Leben lang.
---------------------------------------------------------
Surely goodness and mercy shall follow me,
All the days, all the days of my life.
Surely goodness and mercy shall follow me,
All the days, all the days of my life.

Darum will ich Ihn loben und rühmen ohne Scheu.
Täglich bringen Ihm Ehr', Preis und Dank.
Seine Güte und Gnade und Seine große Treu'
werden folgen mir mein Leben lang.
----------------------------------------------------------
And I shall dwell in the house of the Lord forever,
And I shall feast at the table spread for me,
Surely goodness and mercy shall follow me,
All the days, all the days of my life.";
7521;Süßer Die Glocken Nie Klingen;;"Süßer die Glocken nie klingen
Als zu der Weihnachtszeit; 
`s ist als ob Engelein singen
wieder von Frieden und Freud,
wie sie gesungen in seliger Nacht.
Glocken, mit heiligem Klang 
Klingt doch die Erde entlang!

O wenn die Glocken erklingen,
schnell sie das Christkindlein hört,
muß sich vom Himmel dann schwingen,
eilet hernieder zur Erd,
segnet den Vater, die Mutter, das Kind.
Glocken, mit heiligem Klang 
Klingt doch die Erde entlang!

Klinget mit lieblichem Schalle
Über die Meere noch weit,
dass sich erfreuen doch alle
seliger Weihnachtszeit,
alle aufjauchzen mit einem Gesang!
Glocken, mit heiligem Klang
Klingt doch die Erde entlang"
7532;Tag Für Tag In Allen Lebenslagen;;"Tag für Tag in allen Lebenslagen
find` ich Kraft für meine Pflichten hier.
Gott ist da, ich brauch` nicht zu verzagen,
jeden Grund zur Sorge nimmt er mir.
Dieser Herr will mir das Beste schenken,
gibt mir Freude und auch tiefen Schmerz.
Liebevoll will er mich dadurch lenken,
gibt mir Ruh` und Frieden in mein Herz.

Hilf mir, Herr, in allen Glaubensproben
zu vertrauen deinem Wort allein.
Auch in diesen Zeiten will ich loben,
weil Du mir die Kraft gibst stark zu sein.
Hilf mir, Herr, wenn Lasten mich bedrücken,
sie zu nehmen stets aus Deiner Hand.
Lass mich immer frohen Mutes blicken
hin zu dem von Dir verheiss`nem Land."
7576;Tauch in das Meer;;"Tauch in das Meer der Gnade tief hinein!
Nur Freigewordne können Überwinder sein.
Tauch in das Meer der Gnade tief hinein!
Nur Stillgewordne können Überwinder sein."
7591;Teach me, Lord, / They that wait upon the Lord;D;"Lehr mich, Herr, auszuharren,
auf den Knie'n ganz allein,
bis das Licht, Herr, Deiner Antwort
tief in meine Seele scheint.
Lehr mich, Herr, nicht zu schauen auf das
""Jetzt"" und das ""Hier"",
lehr mich, Jesus, zu warten auf die Antwort von Dir.
--------------------------------------------------------------------
Teach me, Lord, to wait down on my knees,
Till in Your own good time You answer my pleas;
Teach me not to rely on what others do,
But to wait in prayer for an answer from You.

CHORUS
Die da harren auf den Herrn, die erneuern
ihre Kraft, schwingen auf sich empor wie ein Adler,
werden laufen und nicht müde,
werden gehen und nicht matt.
Lehr' mich Herr, lehr' mich warten auf Dich.
--------------------------------------------------------------------
They that wait upon the Lord,
Shall renew their strength,
They shall mount up with wings as an eagle,
They shall run and not be weary,
They shall walk and not faint.
Teach me Lord, teach me, Lord, to wait.

Lehr uns, Herr, auszuharren,
bis die Herzen brennend sind,
bis in Dir, Herr, unser Leben
Seinen wahren Ruh'ort find't.
Herr, erneu're den Glauben,
dass wir schau'n nur auf Dich,
dass wir nur für Dich leben, Herr, darum bitte ich.
--------------------------------------------------------------------------
Teach me, Lord, to wait while hearts are aflame,
Help me humble my pride and call on Your Name.
Keep my faith renewed, keep my eyes on Thee,
Help me be on this earth what You want me to be.

Lehr, mich, Herr, auszuharren
und zu steh'n auf Deinem Wort,
bis die Wahrheit der Verheißung
sich in mir, Herr, offenbart,
was Du sprachst, muss bestehen,
es muss wachsen, gedeih'n,
bis ich nichts mehr and'res sehe, als nur Christus allein.
-------------------------------------------------------------------------------
Teach me, Lord, to wait and to stand on Thy word,
That I hear what you say and I see what you mean:
That the Spoken Word is the original seed
And that nothing can help me but only Thy word.";
7831;The greatest thing / Das Höchste meines Lebens ist;D;"Das Höchste meines Lebens ist,
Dich kennen, Herr!  (2x)
Dich kennen mehr und mehr.  (2x)
Das Höchste meines Lebens ist,
Dich kennen, Herr!
-----------------------------------------------------
The greatest thing in all my life,
Is knowing You.  (2x)
I want to know You more.  (2x)
The greatest thing in all my life,
Is knowing You.

Das Höchste meines Lebens ist,
Dich lieben, Herr!  (2x)
Dich lieben mehr und mehr.  (2x)
Das Höchste meines Lebens ist,
Dich lieben, Herr!
------------------------------------------------
The greatest thing in all my life,
Is loving You.  (2x)
I want to love You more.  (2x), 
The greatest thing in all my life,
Is loving You.

Das Höchste meines Lebens ist,
Dir dienen, Herr!  (2x)
Dir dienen mehr und mehr.  (2x)
Das Höchste meines Lebens ist,
Dir dienen, Herr!
-----------------------------------------------
The greatest thing in all my life,
Is serving You.  (2x)
I want to serve You more.  (2x)
The greatest thing in all my life,
Is serving You.";
7900;The Lord's our rock / Oh, Jesus is a rock;D;"Gott ist mein Hort, Er birgt mich gut,
ein starker Fels im wilden Sturm!
Fest steht Er, braust auch hoch die Flut,
ein starker Fels im wilden Sturm!
------------------------------------------------
The Lord's our rock, in Him we hide,
A shelter in the time of storm;
Secure whatever will betide,
A shelter in the time of storm.

CHORUS
Ja, Jesus will ich trau'n, denn Er ist mein Fels,
Er ist mein Fels, Er ist mein Fels.
Ja, Jesus will ich trau'n, denn Er ist mein Fels,
ein starker Fels im wilden Sturm!
------------------------------------------------------
Oh, Jesus is a rock in a weary land,
A weary land, a weary land;
Oh, Jesus is a rock in a weary land,
A shelter in the time of storm.

Im Sonnenbrand ein kühler Schutz,
ein starker Fels im wilden Sturm,
bei Nacht dem stärksten Feind ein Trutz,
ein starker Fels im wilden Sturm!
--------------------------------------------------
A shade by day, defense by night,
A shelter in the time of storm.
No fears alarm, no foes affright,
A shelter in the time of storm.

Wenn Er gebeut, wird still das Meer,
ein starker Fels im wilden Sturm!
Ich fürchte nichts, mich schützt der Herr,
ein starker Fels im wilden Sturm!
----------------------------------------------------
The raging storms may around us beat,
A shelter in the time of storm;
We'll never leave our safe retreat,
A shelter in the time of storm.

O lieber Fels, o Heiland mein,
o starker Fels im wilden Sturm,
ich flieh' zu Dir, Du birgst mich fein,
Du starker Fels im wilden Sturm!
-------------------------------------------------
Oh, rock divine, oh, refuge dear,
A shelter in the time of storm;
Be Thou our helper ever near,
A shelter in the time of storm.";
7903;The love of God  / Oh love of God, how rich;C / Bb;"Die Liebe Gottes ist viel mehr,
als eine Zunge sagen kann.
Sie reicht hinan zum höchsten Stern
und greift zur tiefsten Sündenbahn.
Für schuldbelad'ne Sünderherzen
gab Gott den Sohn dahin.
Sein irrend Kind versöhnte Er,
vergab die Sünden ihm.
---------------------------------------------
The love of God is greater far
Than tongue or pen can ever tell; 
It goes beyond the highest star,
And reaches to the lowest hell. 
The guilty pair, bowed down with care,
God gave His son to win; 
His erring child He reconciled,
And pardoned from his sin.

CHORUS
O, Liebe Gottes, reich und rein!
So grenzenlos und rein!
In Ewigkeit soll diese Liebe
das Lied der Heiligen sein.
---------------------------------------------------
Oh, love of God, how rich and pure!
How measureless and strong!
It shall forevermore endure,
The saints and angels song.

Wenn einst entschwindet diese Zeit
und ird'sche Reiche hier vergeh'n;
wenn Menschen, die nie beten wollten,
zu Berg und Fels um Hilfe fleh'n;
dann bleibt die Liebe Gottes stehen,
so grenzenlos und rein;
Erlösungsgnade für den Sünder
wird stets der Heil'gen Lied sein.
----------------------------------------------------
When hoary time shall pass away,
And earthly thrones and kingdoms fall;
When men who here refuse to pray,
On rocks and hill and mountains call;
God's love, so sure, shall still endure,
All measureless and strong;
Redeeming grace to Adam's race,
The saints' and angels' song.

Wenn wir das Meer mit Tinte füllten
und wär' der Himmel Pergament;
wär' jeder Halm hier eine Feder,
und jeder damit schreiben könnt';
die Liebe Gottes aufzuschreiben,
das weite Meer verzehrt;
wie könnten Bücher alles fassen,
wär' noch so groß ihr Wert.
---------------------------------------------------
Could we with ink the ocean fill,
And were the skies of parchment made;
Were every stalk on earth a quill,
And every man a scribe by trade; 
To write the love of God above
Would drain the ocean dry; 
Nor could the scroll contain the whole,
Though stretched from sky to sky.";
7924;The Move Is On;A;"Wir gehn voran, o Herr, wir gehn voran,
Wir gehn voran, o Herr, wir gehn voran.
Denn ich höre das Rauschen
in dem Maulbeerbaum
und ich weiß es ganz genau, wir gehn voran.
----------------------------------------------------------------
The move is on, my Lord, the move is on;
The move is on, my Lord the move is on.
I can hear the rustle in the mulberry trees,
And I know, I know, I know the move is on.

Geh weiter Bruder, geh weiter Schwester, 
gehe heut' voran
Lauf ein wenig näher, wo die Ströme fließen;
Bruder, gehe voran!
---------------------------------------------------
Move on brother, move on sister,
This is the moving day.
Move a little closer,
Where the streams are flowing,
Move on brother, move on!";
8047;The word is working mightily / Das Wort es wirkt;D;"Das Wort es wirkt jetzt mächtig auch in mir.
Das Wort es wirkt jetzt mächtig auch in mir.
Egal wie auch der Umstand ist
und was ich fühl' und seh'.
Das Wort es wirkt jetzt mächtig auch in mir. 
-----------------------------------------------------------
The Word is working mightily in me.
The Word is working mightily in me.
No matter what the circumstance, 
Or what I feel or see.
The Word is working mightily in me.

Das Wort es wirkt jetzt mächtig auch in dir.
Das Wort es wirkt jetzt mächtig auch in dir.
Egal wie auch der Umstand ist
und was ich fühl' und seh'.
Das Wort es wirkt jetzt mächtig auch in dir. 
-------------------------------------------------------------
The Word is working mightily in you.
The Word is working mightily in you.
No matter what the circumstance, 
Or what I feel or see.
The Word is working mightily in you.

Das Wort es wirkt jetzt mächtig auch in uns.
Das Wort es wirkt jetzt mächtig auch in uns.
Egal wie auch der Umstand ist
und was ich fühl' und seh'.
Das Wort es wirkt jetzt mächtig auch in uns.
-------------------------------------------------------------
The Word is working mightily in us.
The Word is working mightily in us.
No matter what the circumstance, 
Or what I feel or see.
The Word is working mightily in us.";
8064;There are people almost / One of them, one of them;G;"Da sind Menschen auf der ganzen Welt,
die heut' noch brennend sind
mit dem Feuer, das zu Pfingsten fiel,
in dem die Sünd' vergeht,
und es brennt auch jetzt in meinem Herz',
das Ihm die Ehre gibt,
Bin so froh, ich weiß genau, ich bin Sein Kind!
-----------------------------------------------------------------------
There are people almost everywhere,
Whose hearts are all aflame,
With the fire that fell at Pentecost,
Which cleansed and made them clean;
It is burning now within my heart,
All glory to His Name!
I'm so glad that I can say I'm one of them!

CHORUS
Bin Sein Kind, ja Sein Kind.
Bin so froh, ich weiß genau, ich bin Sein Kind!
Bin Sein Kind, ja Sein Kind.
Bin so froh, ich weiß genau, ich bin Sein Kind!
------------------------------------------------------------------
One of them, one of them,
I´m so glad that I can say I'm one of them!
One of them, one of them,
I'm so glad that I can say I'm one of them!

Ja, wenn sie auch nicht viel wussten,
und sie waren nicht beliebt,
hatten sie alle ihr Pfingsten doch
in Christus selbst erlebt,
und auch heute gibt es Zeugen,
dass es Gottes Kraft noch gibt,
Bin so froh, ich weiß genau, ich bin Sein Kind!
------------------------------------------------------------------
Though these people may not learned be,
Nor boast of worldly fame,
They have all received their Pentecost,
Baptized in Jesus' Name;
And are telling now, both far and wide,
His power is yet the same,
I'm so glad that I can say I'm one of them!

Sie war'n alle in dem Obersaal,
und waren im Gebet,
Gott erfüllte sie mit Heil'gem Geist
und hat Sein Volk belebt,
heute noch kann Er dasselbe tun,
wenn sich Sein Geist bewegt.
Bin so froh, ich weiß genau, ich bin Sein Kind!
-------------------------------------------------------------------------
They were gathered in the upper room,
All praying in His Name,
They were baptized with the Holy Ghost,
And pow'r for service came.
Now what He did for them that day
He'll do for you the same;
I'm so glad that I can say I'm one of them!

Komm, mein Bruder, such' den Segen,
in dem alles Heil besteht,
der dir Freude überströmend gibt
und dich aus Sünd' erhebt,
und es brennt auch jetzt in meinem Herz',
o Ehre Seinem Nam'.
Bin so froh, ich weiß genau, ich bin Sein Kind!
---------------------------------------------------------------
Come, my brother, seek this blessing
That will cleanse your heart from sin,
That will start the joy-bells ringing
And will keep the soul aflame;
It is burning now within my heart,
All glory to His Name!
I'm so glad that I can say I'm one of them!";
8103;There is none like You / Keiner ist wie Du;F;"Chorus
Keiner ist wie Du!
Niemand sonst berührt mein Herz so wie Du.
Wo auch immer ich noch suchte, o Herr, es bleibt:
Keiner ist wie Du!
--------------------------------
There is none like You,
No one else can touch my heart like You do.
I can search for all eternity long,
And find there is none like You.

Your mercy flows like a river wide,
And healing comes from Your hand.
Suffering children are safe in Your arms,
There is none like You.";
8148;There's a voice calling me;;"Da ist eine Stimme, die mir von einem
alt rauen Stamm zuruft, sie flüstert:
Komm näher zu mir!
Lass die Welt hinter dir zurück, da gibt es neue
Höhen zu erklimmen, und du wirst einen neuen
Ort in Mir finden.

CHORUS
Denn was auch immer nötig ist, um Dir näher zu kommen, 
HErr, das bin ich bereit zu tun. 
Was es auch benötigt, Dir ähnlicher zu werden, 
Das bin ich bereit zu tun.

Nimm die Dinge, die mir am liebsten sind,
wenn das nötig ist, um mich Dir näher zu bringen.
Lass Enttäuschungen kommen, einsame Tage
ohne Sonnenschein, wenn ich durch Leiden Dir
ähnlicher werden kann.

Nimm meine  Häuser, mein Land, 
ändere meine Träume und meine Pläne, 
denn ich lege mein ganzes Leben in Deine Hände. 
Und wenn Du mich heute zu einem weit entfernten
Land rufst, HErr, dann werde ich Deinem Willen gehorchen.

Ich tausche Sonnenschein gegen Regen ein,
Trost gegen Schmerzen. 
Das möchte ich tun. 
Was auch immer es erfordern wird  
meinen Willen zu brechen, möchte ich tun."
8292;Tief in der Gruft Er lag;B;"Tief in der Gruft Er lag, Jesus, 
mein Heiland! Der Auferstehung 
harrt' Jesus, mein HErr!

CHORUS
Jesus ist Sieger und lebt!
Triumphierend sich der HErr erhebt!
Ja, Er lebt und sieget über Tod und Höll',
ewig wird Er herrschen, Gott, Immanuel.
Jesus lebt! Jesus lebt! Halleluja, Jesus lebt!

Umsonst steht dort die Wacht, 
Jesus, mein Heiland! 
Umsonst des Siegels Macht, 
Jesus, mein HErr!

Tod kann nicht halten Dich, 
Jesus, mein Heiland! 
Er alle Riegel bricht, Jesus, mein HErr!"
