5973;Nun danket alle Gott;;"Nun danket alle Gott
mit Herzen Mund und Händen,
der große Dinge tut
an uns und allen Enden;
der uns von Mutterleib
und Kindesbeinen an
unzählig viel zu gut
und noch jetzt hat getan.

Der ewigreiche Gott
woll uns bei unserm Leben
ein immer fröhlich Herz
und edlen Frieden geben
und uns in Seiner Gnad
erhalten fort und fort 
und uns aus alle Not
erlösen hier und dort.

Lob, Ehr und Preis sei Gott,
dem Vater und dem Sohne,
und dem, der beiden gleich
im höchsten Himmelsthrone,
Ihm, dem dreieingen Gott,
als der im Anfang war
und ist und bleiben wird,
wie jetzt, so immerdar."
5974;Nun habe ich ausgestritten;;"Nun hab ich ausgestritten, 
ich kämpfe fürder nicht!
Genug hab ich gelitten 
und doch nichts ausgericht´.
Es brannte mir im Herzen, 
verzehrte meine Kraft:
Ich wollte heilig werden 
und wußt nicht, wie man´s schafft.

Nun habe ich´s gefunden 
und bin zur Ruh gebracht.
Am Kreuz hat es mein Heiland 
so lange schon vollbracht.
Seit ich in Seinen Zügen 
gesehn mein eigen Bild,
ist alle Qual und Sehnsucht 
für ewig mir gestillt.

O Jesus, mein Erlöser, 
fürwahr, Du hast´s getan!
Ich kniee hin und staune 
ob Deinem Liebesplan!
Du wohnst in meinem Herzen 
und lebst Dein Leben aus -
und ich, ich knie und staune 
und ruh für ewig aus.

Du wohnst in meinem Herzen 
mit Deiner Heiligkeit,
mit Deinem ganzen Wesen, 
und überwindest weit.
In Deinen Armen ruh ich, 
Du trägst mich himmelan; 
und ich, - ich ruhe, ruhe 
und bete staunend an.

Ich kann es nicht begreifen, 
zu groß ist meine Freud!
O, nur Dich anzubeten 
in alle Ewigkeit!
O, nur Dich anzubeten, 
in Deinem Willen ruhn; 
- in alle Ewigkeiten 
mag ich nichts andres tun."
5975;Nun jauchzt dem Herrn allezeit;;"Nun jauchzt dem Herren, aller Welt!
Kommt her, zu seinem Dienst euch stellt,
kommt mit Frohlocken, säumet nicht,
kommt vor Sein heilig Angesicht.

Erkennt, dass Gott ist unser Herr,
der uns erschaffen Ihm zu Ehr,
Und nicht wir selbst.  Durch Gottes Gnad
Ein jeder Mensch sein Leben hat.

Er hat uns ferner wohl bedacht
Und uns zu Seinem Volk gemacht,
zu Schafen, die Er ist bereit
zu führen stets auf gute Weid.

Die ihr nun wollet bei Ihm sein,
Kommt, geht zu Seinen Toren ein
Mit Loben durch der Psalmen Klang, 
zu Seinem Vorhof mit Gesang.

Erhebet Gott, lobsinget Ihm,
Lobsinget Ihm mit hoher Stimm,
Lobsingt und lobet allesamt.
Gott loben, das ist unser Amt.

Er ist voll Güt und Freundlichkeit,
voll Treu und Lieb zu jeder Zeit.
Sein Gnade währet dort und hier
Und Seine Wahrheit für und für.

Gott Vater in dem höchsten Thron
Und Jesus Christ, Sein einger Sohn,
Samt Gott, dem werten heilgen Geist,
sei nun und immerdar gepreist."
5976;Nun Lasst Uns Gehen Und Treten;;"Nun lasst uns gehen und treten
Mit Singen und mit Beten
Zum Herrn, der unserm Leben
Bis hierher Kraft gegeben!

Wir gehen dahin und wandern
Vom einem Jahr zum andern;
Wir leben und gedeihen
Vom alten bis zum neuen.

Ach, Hüter unsers Lebens,
Fürwahr, es ist vergebens
Mit unsrem Tun und Machen,
wo nicht Dein Augen wachen.

Gelobt sei Deine Treue,
Die alle Morgen neue;
Lob sei den starken Händen, 
die alles Herzleid wenden!

Sprich Deinen milden Segen 
Zu allen unsern Wegen;
Laß Großen und auch Kleinen
Die Gnadensonne scheinen!

Und endlich, was das meiste:
Füll uns mit Deinem Geiste,
der uns hier herrlich ziere
und dort zum Himmel führe!

Dies alles wollst du geben,
O meines Lebens Leben!
Dein Heil uns offenbare
Zum selgen neuen Jahre!"
5977;Nun Lobet Alle Gottes Sohn;;"Nun lobet alle Gottes Sohn,
der die Erlösung funden,
beugt eure Knie vor Seinem Thron!
Sein Blut hat überwunden. 
Preis, Lob, Ehr, Dank, Kraft,
Weisheit, Macht
Sei dem erwürgten Lamm gebracht!

Es war uns Gottes Licht und Gnad
und Leben hart verriegelt,
Sein tiefer Sinn, Sein Wunderrat
wohl siebenfach versiegelt,
kein Mensch, kein Engel öffnen kann,
das Lamm vollbracht's drum lobe man!

Nun Dein erkauftes Volk allhier spricht:
""Halleluja, Amen!
Wir beugen jetzt schon unsre Knie
in Deinem Blut und Namen,
bis Du uns bringst zusammen
dort aus allem Volk,
Geschlecht und Ort.""

Was wird das sein, was werden wir
von ewger Gnade sagen,
wie uns Dein Wunder führen hier
gesucht, erlöst, getragen
wenn jeder seine Harfe bringt
und sein besondres Loblied singt.!"""
5978;Nun Preiset Alle Gottes Barmherzigkeit;;"Nun preiset alle
Gottes Barmherzigkeit!
Lobt Ihn mit Schalle,
Ihr Christen weit und breit.
Er lässt dich freundlich zu sich laden;
Freue dich, Israel, Seiner Gnaden!
Freue dich, Israel, Seiner Gnaden!

Der Herr regieret über die ganze Welt,
Was sich nur rühret,
alles zu Fuß Ihm fällt.
Viel tausend Engel Ihn umschweben, 
Psalter und Harfe Ihm Ehre geben,
Psalter und Harfe Ihm Ehre geben.

Wohlauf, ihr Heiden 
lasset das Trauern sein, 
zu grünen Weiden stellet euch willig ein;
da lässt Er uns Sein Wort verkünden, 
machet uns ledig von allen Sünden,
machet uns ledig von allen Sünden.

Er gibet Speise reichlich und überall,
nach Vaterweise sättigt Er allzumal;
er schaffet früh und späten Regen,
füllet uns alle mit Seinem Segen,
füllet uns alle mit Seinem Segen.

Drum preis und ehre 
Seine Barmherzigkeit, 
Sein Lob vermehre du, 
ganze Christenheit!
Und soll hinfort kein Unfall schaden, 
freue dich, Israel, Seiner Gnaden!
Freue dich, Israel, Seiner Gnaden!"
5980;Nur das Leben von Jesus Christ;C;"Nur das Leben von Jesus Christ,
das lässt den Teufel beben,
nur das Leben, das Jesus gibt,
das wahre, ew'ge Leben.
Gott hatte einen Plan,
Er nahm die Menschen an.
Er wohnt in dir, Er wohnt in mir.
Das ist der Himmel heut' schon hier!"
5981;Nur ein Schmaler Weg;;"Höret, ein schmaler Weg: ""Ich bin der Weg!""
Nur eine offne Tür: ""Ich bin die Tür!""
O, nur ein guter Hirt rettet, was krank und irrt,
und nur ein blutend Lamm starb für die Welt.

Chorus
O, nur ein schmaler Weg: ""Ich bin der Weg!""
Nur eine offne Tür: ""Ich bin die Tür!""

Nur eine heilge Schar, völlig geeint,
wie es zu Pfingsten war, ist die Gemeind'.
Nur eine milde Hand
leitet durch Spott und Schand'
die kleine, treue Herd' zum Vaterhaus.

O, sieh Sein teures Blut! Es floss für dich.
Sieh deinen treusten Freund, Er starb für dich.
Bei Jesus findest du einzig die eine Ruh,
den einen Gnadenquell, eile Ihm zu!"
5982;Nur Ein Ungewisses Hoffen;;"Nur ein ungewisses Hoffen
ist der Glaube dieser Welt;
Jedem Zweifel steht es offen,
wenn das Herz auch stark sich stellt.
Der Glaube des Christen
kann nimmer verzagen,
Mit seinem Erlöser kann alles er wagen;
Er hofft aufs Gewisseste, was er nicht sieht;
Das Bangen verstummt,
und der Zweifel entflieht.

Glaube ist kein zagend Schweben;
nicht ein fragend: ""Kann wohl sein!""
Solcher Glaube hat kein Leben, 
ist nicht Wahrheit, sondern Schein.
Der Glaube steht fest wie ein Felsen im Meere
Und trotzet der Zweifel 
aufsteigendem Heere;
Mag Himmel und Erde und alles vergehn,
So sehn wir die Fahne des Glaubens 
noch wehn.

In dem Wust des Erdentandes
blähet die Vernunft sich auf;
In den Fesseln des Verstande
geht des Wissens matter Lauf.
Der Glaube zersprengt
die irdischen Ketten,
Und weiß vom Gewirr der Vernunft
sich zu retten, Er strebet zum Himmel, 
ein kräftiger Baum, und lässt dem Verstande
die Zeit und den Raum.

Tot und kraftlos ist der Glaube,
wird er nicht vom Geist entflammt;
Liegt gefesselt in dem Staube,
wenn er von der Erde stammt.
Mein Jesus, o sende den Geist mir hernieder,
Und stärke die oft so ermatteten Glieder!
Fortan sei der Glaube der siegende Held,
Erlegend die Selbstsucht,
den Teufel, die Welt!"
5983;Nur ein Verlangen hab ich noch;;"Nur ein Verlangen hab ich noch,
mein Jesus, das bist Du;
lehr tragen mich Dein sanftes Joch,
gib mir die Kraft dazu.

Nur eine Sehnsucht füllt mein Herz,
es ist mein heißes Flehn:
""O Jesus, laß mir allerwärts
Dein Bild vor Augen stehn.""

Du gingst für mich den Kreuzespfad,
Du trugest meine Schuld.
O Herr, wie groß ist Deine Gnad!
O welche Lieb und Huld!

Dein liebend Auge auf mich schaut,
ich kann nicht widerstehn.
Welch Glück, o Herr! Wer Dir vertraut,
wird Herrlichkeiten sehn.

Ich preise Deine Liebestreu,
mein Heiland, inniglich.
In Dir bin ich nun völlig frei
und steh in deinem Licht."
5984;Nur Gefäße;;"Herr, wir loben Deine Gnade,
die uns ganz für Dich gewann,
rettend, reingend und erfüllend,
uns Dir bräuchlich machen kann.

Chorus
Nur Gefäße, heilger Meister,
doch gefüllt mit Deiner Kraft,
laß für uns und durch uns strömen
Leben, das Dein Geist uns schafft!

Nur Gefäße, doch von Segen 
für die Durstgen  rings umher,
lass uns sein, geliebter Heiland,
mach dazu uns täglich mehr!

Leer, damit Du ganz uns füllest
Als Gefäße Deiner Hand,
und mit keinem andern Siegel
als nur dem ""von Dir gesandt"".

Von der Rettermacht zu zeugen,
die von Sünden uns befreit,
dazu sind wir ausgesondert,
dazu hast Du uns geweiht.

Jesus, füll mit Deinem Geiste 
jedes Herz, das völlig Dein,
lass den Strom lebend´gen Wassers
bei und durch uns mächtig sein!"
5985;Nur Ihm allein;;"Nur Ihm gehört mein Herz und Sinn,
der mir das Heil gegeben.
Seit ich durch Ihn gerettet bin,
ist Ihm geweiht mein Leben,
nur Ihm, nur Ihm, nur Ihm allein,
nur Ihm, nur Ihm, nur Ihm allein,
nur Ihm, nur Ihm, nur Ihm allein!

Nur Ihm gehör ich ganz und voll,
folg Seinem Hirtenstabe.
Ich weiß nicht, wie ich leben soll,
wenn ich nicht Jesum habe,
nur Ihn, nur Ihn, nur Ihn allein,
nur Ihn, nur Ihn, nur Ihn allein,
nur Ihn, nur Ihn, nur Ihn allein!

Nur Ihm gehör ich ewig zu,
es wird an nichts mir fehlen.
Bei Ihm ist Segen, Heil und Ruh,
ich kann nichts andres wählen,
nur Ihn, nur Ihn, nur Ihn allein,
nur Ihn, nur Ihn, nur Ihn allein,
nur Ihn, nur Ihn, nur Ihn allein!

Nur Ihm gehört auch mein Gesang,
Er hat mir´s Herz genommen.
Ihm will ich singen lebenslang,
bis ich zu Ihm werd kommen,
zu Ihm, zu Ihm, zu Ihm allein,
zu Ihm, zu Ihm, zu Ihm allein,
zu Ihm, zu Ihm, zu Ihm allein!"
5986;Nur mit Jesus will ich Pilger wandern;G;"Nur mit Jesus will ich Pilger wandern,
nur mit Ihm geh' froh ich ein und aus.
Weg und Ziel find' ich bei keinem andern,
Er allein bringt Heil in Herz und Haus,
Er allein bringt Heil in Herz und Haus.

Berg und Tal und Feld
und Wald und Meere,
froh durchwall ich sie an Seiner Hand.
Wenn der Herr nicht mein Begleiter wäre,
fänd' ich nie das wahre Vaterland,
fänd' ich nie das wahre Vaterland.

Er ist Schutz, wenn ich mich niederlege,
Er mein Hort, wenn früh ich stehe auf.
Er mein Rater auf dem Scheidewege und
mein Trost bei rauhem Pilgerlauf,
und mein Trost bei rauhem Pilgerlauf.

Bei dem Herrn will ich stets Einkehr halten,
Er sei Speis' und Trank und Freude mir.
Seine Gnade will ich lassen walten, Ihm
befehl ich Leib und Seele hier, Ihm befehl 
ich Leib und Seele hier.

Bis es Abend wird für mich hernieden und
Er ruft zur ew'gen Heimat hin, 
bis mit Ihm ich gehe ein zum Frieden,
wo Sein sel'ger Himmelsgast ich bin,
wo Sein sel'ger Himmelsgast ich bin.";
5987;Nur zu Dir, großer Vater;;"O nur zu Dir! Du großer Vater,
die Seele strebt empor zu Dir!
Laß mich in Deinen Armen liegen,
laß mich ans Vaterherz mich schmiegen,
Du siehst die Sehnsucht, die in mir,
Du siehst die Sehnsucht, die in mir!

Wie Du zu Henoch einst geredet, 
dass wohlgefällig Dir sein Tun,
o Vaterherz, ich kann nicht leben:
Du musst auch mir dies Zeugnis geben, 
dass ich Dir wohlgefällig nun,
dass ich Dir wohlgefällig nun!

O Vaterherz, Dir zu gefallen,
ist meiner Sehnsucht einzges Ziel!
O sieh den Schmerz, sieh das Verlangen,
mein  Wünschen, Wollen ruht gefangen,
und nur zu Dir die Seele will,
und nur zu Dir die Seele will.

O nur zu Dir! Schon längst versunken, 
verklungen ist der Lärm der Welt.
Mein Herz ist ein verschlossner Garten,
wo Blumen blühn, die Deiner warten,
wo nur der König Einzug hält,
wo nur der König Einzug hält.

O Vaterherz, des Geistes Feuer
durchglühe völlig Herz und Sinn;
durchheilige mein tiefstes Wesen,
laß Erd und Himmel bald es lesen,
dass ich Dir wohlgefällig bin,
dass ich Dir wohlgefällig bin!"
6013;Näher Mein Gott;;"Näher, mein Gott, zu Dir,
näher zu Dir!
Drückt mich auch Kummer hier,
drohet man mir,
soll doch trotz Kreuz und Pein
dies meine Losung sein:
Näher, mein Gott, zu Dir,
näher zu Dir.

Bricht mir wie Jakob dort
Nacht auch herein,
find ich zum Ruheort
nur einen Stein,
ist auch im Traume hier
mein Sehnen für und für:
Näher, mein Gott, zu Dir,
näher zu Dir.

Geht auch die schmale Bahn
aufwärts gar steil,
führt sie doch himmelan
zu unser`m Heil.
Engel, so licht und schön,
winken aus sel`gen Höh`n.
Näher, mein Gott, zu Dir,
näher zu Dir."
6014;Näher, noch näher;D;"Näher, noch näher, 
fest an Dein Herz ziehe mich, 
Jesus, durch Freude und Schmerz! 
Birg mich aus Gnaden in Deinem Zelt, 
schirme und schütze mich, 
Heiland der Welt! 
Schirme und schütze mich, 
Heiland der Welt!

Näher, noch näher! 
Nichts hab' ich hier, nichts, 
was als Opfer, HErr, tauget vor Dir. 
Ach, nur ein sünd'ges Herze ist mein. 
Jesus, mein König, o wasche mich rein! 
Jesus, mein König, o wasche mich rein!

Näher, noch näher! 
Ganz in den Tod gebe ich willig, 
mein Heiland und Gott, 
was Deinen Segen hemmte in mir: 
Weltliche Freuden und irdische Zier, 
weltliche Freuden und irdische Zier.

Näher, noch näher, 
völl'ger und frei, 
bis alles eigene Ringen vorbei, 
bis all mein Leben 
Dein Abglanz ist und Du, 
HErr Jesus, mein alles mir bist, 
und Du, HErr Jesus, mein alles mir bist!"
6052;O Gebt Jesus Ehre;;"O, gebt Jesus Ehre, 
o, gebt Jesus Ehre,
der uns mit Seinem Blut erkauft,
o, gebt dem Heiland Ehre!

O, gebt Jesus Ehre, 
o, gebt Jesus Ehre,
der uns mit Geist und Feuer tauft,
o, gebt dem Heiland Ehre!

O, gebt Jesus Ehre, 
o, gebt Jesus Ehre,
bei Ihm ist Leiden Herrlichkeit,
o, gebt dem Heiland Ehre!

O, gebt Jesus Ehre, 
o, gebt Jesus Ehre,
geht glaubend 
durch die finst're Nacht,
o, gebt dem Heiland Ehre!"
6053;O glaub es und trau Seiner Gnade (Nieste);;"Oh, wunderbar süss ist die Botschaft!
So traut und so herzlich sie klingt,
verkündigt die ew`ge Erlösung,
die Jesus, der Heiland uns bringt.

CHORUS
Oh, glaub es und trau` Seiner Gnade!
Sie fliesst wie ein Strom auch für dich.
Oh, glaub`s und nimm an die Erlösung,
sie gilt ja für dich und für mich.

Er stieg von dem himmlischen Throne,
verliess Seine Heimat voll Pracht,
zu brechen die Fesseln der Knechtschaft,
zu bringen das Licht in die Nacht.

Oh, komm zu dem mächtigen Heiland,
mühselig, beladen, komm her!
Schau hin, wie am Kreuze Er gelitten,
vertrau Ihm und zweifle nicht mehr.

Kein and`rer als Jesus kann helfen,
es gibt ja kein anderes Heil.
Noch steht Er geduldig und wartet.
Oh Seele, nicht länger verweil!"
6056;O Gotteslieb, So Voll Und Frei;;"O Liebe, goldner Sonnenschein
fürs arme Menschenherz, 
strahlst du nur hell in mich hinein,
versüßt ist jeder Schmerz. 
Das Dunkel weicht, die Nacht entflieht,
wenn warm die Sonne scheint, 
und Freud und Lebenswonne
zieht hinein ins Herz, das weint.

Chorus
O Gotteslieb, so voll und frei,
von alters her und immer neu,
sie quillt für mich, sie quillt für dich 
und zieht uns alle hin zu sich.

Als von der Lieb am Kreuzespfahl
in meine Sündennacht eindrang
der helle Sonnenstrahl, 
bin ich für Gott erwacht.
Seitdem ich weiß, wer mich geliebt
bis in den Tod so heiß, 
mein Herz sich Ihm zu eigen gibt
zu Seines Namens Preis!

Die Sonne, die mir scheinet hell,
mir Lebenswonne beut, ist Jesus, 
mein Immanuel, nur Er in Ewigkeit!
Ihm singe ich mein Jubellied
schon hier im Trännental und ewig, 
wenn mein Aug Ihn sieht, 
in Seinem Himmelssaal."
6062;O Halleluja, ´s ist vollbracht;;"Seit ich erlöst von Sündenmacht,
seit Jesus Freiheit mir gebracht,
da frag ich nicht nach Erdenleid,
mir strahlt des Himmels Herrlichkeit.

Chorus
O Halleluja, es ist vollbracht!
Mein Jesus hat mich freigemacht!
Ob Land, ob Meer, ob Glück, ob Leid,
wo Jesus ist, ist Herrlichkeit.

Seit ich gesehn Sein Angesicht,
umleuchtet mich des Himmels Licht!
Nun ist mein Leben nicht mehr mein,
in Ewigkeit, o Jesus, Dein!

Was frage ich nach Tag und Zeit,
nach Erdenlust und Erdenfreud?
Geborgen in des Heilands Hut 
voll Himmelslust die Seele ruht!"
6064;O Haupt voll Blut und Wunden;D;"O Haupt, voll Blut und Wunden,
voll Schmerz und voller Hohn!
O Haupt, zum Spoott gebunden
mit einer Dornenkron!
O Haupt, sonst schön gezieret
mit höchster Ehr und Zier,
jetzt aber höchst schimpfieret:
Gegrüßt seist Du mir!

Du edles Angesichte,
davor sonst schrickt und scheut
das große Weltgerichte,
wie bist Du so bespeit! Wie bist Du
so erbleichet! Wer hat Dein Augenlicht,
dem sonst kein Licht nicht gleichet,
so schändlich zugericht'?

Nun, was Du, Herr, erduldet,
ist alles meine Last; ich hab es
selbst verschuldet, was Du getragen
hast. Schau her, hier steh ich Armer,
der Zorn verdienet hat: Gib mir, o mein
Erbarmer, den Anblick Deiner Gnad!

Ich danke Dir von Herzen, o Jesus,
liebster Freund, für Deine
Todesschmerzen,
da Du's so gut gemeint.
Ach gib, daß ich mich halte zu Dir
und Deiner Treu, und wenn ich einst
erkalte, in Dir mein Ende sei!

Wenn ich einmal soll scheiden,
so scheide nicht von mir;
wenn ich den Tod soll leiden,
so tritt Du dann herfür! Wenn mir
am allerbängsten wird um das
Herze sein, so reiß mich
aus den Ängsten
kraft Deiner Angst und Pein!

Erscheine mir zum Schilde, zum Trost
in meinem Tod, laß mich sehn
Dein Bilde in Deiner Kreuzesnot!
Da will ich nach Dir blicken, da will
glaubensvoll Dich fest an mein Herz
drücken. Wer so stirbt, der stirbt wohl."
6065;O Herrlicher Retter;;"O herrlicher Retter,
mein König, mein Herr, 
o Jesus, Du Heiland der Welt!
Mit Strömen der Freude
erfüllst Du das Herz 
und birgst mich in Deinem Gezelt.

Chorus
Im Schatten des Felsens,
da ist es gar traut, 
brennt heiß in der Wüste die Glut.
O ewige Liebe, in Deinem Gezelt, 
wie ruht da die Seele so gut! 
Wie ruht da die Seele so gut!

O Jesus, mein Heiland,
wie bist Du so treu! 
Du hast mir die Freiheit verschafft. 
Es schützt mich
und trägt Deine helfende Hand 
und füllt mir die Seele mit Kraft.

Mit Freudenöl
hast Du das Haupt mir gesalbt 
und schenkst mir den Becher voll ein.
Ich singe und preise und juble empor, 
dass solch ein Erlöser ist mein!

Und wenn ich in Wolken
des Himmels entrückt, 
empor in die Herrlichkeit geh,
dann rühme ich jubelnd die ewige Lieb 
und preise Dich, Gott, in der Höh!"
6068;O hört das wunderbare Wort;;"O hört das wunderbare Wort,
das Evangelium, und sagt es immer
weiter fort zu Gottes Preis und Ruhm!
Das Wort vom Kreuz  ist Gotteskraft,
die lauter Gnadenwunder schafft;
Dringt dir dies Wort durch Mark und Bein,
wirst du noch heut gerettet sein.

""Es ward die Welt, die Gott verhöhnt,
mit Ihm zur selben Stund,
als sie Ihn kreuzigte, versöhnt"",
so spricht des Höchsten Mund.
O Golgatha, o Golgatha! Wer fasst,
was einst für uns geschah?
Hier rang die Liebe mit dem Zorn
und öffnete den Gnadenborn!

Komm, sieh, was nie ein Auge sah,
komm, blicke dich gesund!
Für mich, für dich hängt Jesus da,
für uns schlug man Ihn wund.
O Seele, sieh, o Seele, sieh!
Vergiss die große Liebe nie!
Es stirbt der Sünde Zauberreiz
durch einen Glaubensblick aufs Kreuz.

Ach sieh das teure Gotteslamm,
es gab Sich dir zugut!
Tritt nah herzu zum Kreuzesstamm
und schau das teure Blut.
Das Blut, das Blut, das Blut allein
macht uns von allen Sünden rein.
Es löst der  Sünden größten Schmerz
und öffnet Gottes Vaterherz!"
6069;O ich liebe Ihn;G;"O ich liebe Ihn! Ja, ich liebe Ihn,
weil Er blutend für mich starb.
O ich liebe Ihn! Ja, ich liebe Ihn,
der am Kreuz mir Heil erwarb."
6070;O ich weiß ein Land / Wunderschönes Land;C;"O, ich weiß ein Land
hinterm Wolkenmeer so weit,
einen schönen Strand
in der größten Herrlichkeit.
Oh, ich sehne mich
nach Jerusalem so sehr,
wo es gibt kein Scheiden mehr.

Chorus
Wunderschönes Land,
oh, ich sehne mich hier fort.
An dem klaren Strand,
liebe Freunde warten dort.
Oftmals hör ich schon, wenn
mein Herz ist schwer und bang,
ihren freud'gen Lobgesang.

Dieser Erde Sorgen
sind endlich bald vorbei.
In des Vaters Haus
sind wir alle froh und frei.
Ach, mein Sehnen geht
von der Erde Müh' und Last
nach dem Land der süßen Rast.

Oh, ich schau im Glauben
das wundervolle Land.
Oh welch Glück für mich,
wenn ich steh am gold'nen Strand.
Ich will eilen vorwärts
durch Trübsal und Gefahr,
Preis sei Gott, bald bin ich da!";
6072;O ja, ich lieb' den HERRN von Galilä';F;"O ja, ich lieb' den HERRN von Galilä',
denn Er hat so viel für mich getan!
Er vergab mir meine Sünd', 
gab mir den Heil'gen Geist.
O, ich lieb' den HERRN von Galilä'!"
6078;O kommet doch alle zum Kreuze;;"O Seele, komm eilend zum Kreuze!
Es ladet der Heiland dich ein;
Hier fließet der Born Seiner Gnade
So herrlich für groß und für klein.

Chorus
O kommet doch alle zum Kreuze,
zum Kreuze nur eilend hinzu!
So gibt euch der Heiland noch heute,
noch heute die selige Ruh!

O suche Vergebung und Frieden 
beim Kreuz für dein trauriges Herz!
Dein Jesus beglückt schon hienieden
Und heilet dir jeglichen Schmerz.

O suche Erlösung von Sünden am Kreuz
Durch des Heilandes Blut.
Da sollst du das volle Heil finden,
dies köstliche, himmlische Gut.

O selige Hoffnung des Lebens,
der Herrlichkeit droben beim Herrn.
Wir kommen zum Kreuz nicht vergebens,
schon schimmert die Krone von fern."
6079;O Kommet Und Nehm Den Gekreuzigten An;;"O kommet und nehmt
den Gekreuzigten an!
O kommet und glaubt´s,
dass Er retten euch kann!
Bei Ihm wird euch
freie Vergebung zuteil, 
denn Jesus erwarb uns
ein völliges Heil!

Chorus
O komm doch,
der Meister harrt deiner so treu!
Komm, Jesu Erlösung
ist wunderbar frei!
Bei Ihm wird dir freie
Vergebung zuteil, 
denn Jesus erwarb uns
ein völliges Heil!

O kommet, und lauschet
der Botschaft so gut!
O kommet, vertraut
auf des Heilandes Blut!
So wird euch
das ewige Leben zuteil, 
denn Jesus erwarb uns
ein herrliches Heil!

O kommet, dem Dienste
der Sünde absagt!
O kommet und freudig
mit Jesu es wagt!
So wird euch
noch heute der Friede zuteil, 
o eilt und ergeifet
noch heute das Heil!"
6083;O Lasset Uns Anbeten Den König;;"Herbei, o ihr Gläubigen,
fröhlich triumphierend,
o kommet, o kommet 
nach Bethlehem!
Sehet das Kindlein,
uns zum Heil geboren.
O lasset uns anbeten, 
o lasset uns anbeten,
o lasset uns anbeten den König!

Du König der Ehren, 
Du Herrscher der Heerscharen,
Du ruhst in der Krippe gering und arm,
du wahrer Gott, von Ewigkeit geboren.
O lasset uns anbeten,
o lasset uns anbeten,
o lasset uns anbeten den König!

Kommt, singet dem Herren,
o singt Ihm, Engelchöre!
Frohlocket, frohlocket, ihr Seligen:
Ehre sei Gott im Himmel und auf Erden!
O lasset uns anbeten, 
o lasset uns anbeten,
o lasset uns anbeten den König!

O Dir, der Du heute bist Mensch
für uns geboren,
Herr Jesus, sei Ehre
und Preis und Ruhm,
Dir Fleisch gewordnes Wort 
des ewgen Vaters!
O lasset uns anbeten,
o lasset uns anbeten,
o lasset uns anbeten den König!"
6084;O Leben, Ja Leben Sollst Du;;"Oh schaue zum Kreuze des Herrn:
Er hängt dort im Blute für dich!
Die Sünden vergibt er dir gern, 
die Schuld nahm Er 
iebreich auf sich.

Chorus
O leben, ja leben sollst du, 
in Jesu Blut findest du Ruh;
dort findest du Ruh;
o eile zum Kreuze hinzu!

Du bist ja verwundet und krank, 
die Sünde ist mächtig in dir.
O warte nun länger nicht mehr, 
dein Arzt dein Erretter ist hier.

Jetzt ist noch die Gnadenzeit da, 
doch allzu bald ist sie entflohn.
Oh suche die Rettung doch ja, 
noch findest du Leben im Sohn!

O blicke im Glauben empor:
Am Kreuz hängt er blutig für dich!
Ach komm, Seele, tritt jetzt hervor
Und ruf: ""Heiland,
hier hast du mich!"""
6114;O Sagt Mir Kann Ich Traurig Sein;;"O sagt mir, kann ich traurig sein,
wenn ich den Heiland habe?
Da weiß ich doch von keiner Pein,
sänk alles auch zu Grabe.
Wie immer mich die Welt umtobt,
der Herr sei ewiglich gelobt,
an dem ich mich erlabe,
an dem ich mich erlabe.

Ich weiß von keinem Herzeleid,
ist Jesus mir zur Rechten.
Er geht voran und führt den Streit
und wird den Sieg erfechten.
Ich weiß, dass ich gewinnen soll,
wenn ich mich nur vertrauensvoll
Dem Heiland übergebe,
dem Heiland übergebe.

Ziehn auch Gewitter um mich her,
ich will dem Herrn vertrauen.
Bedroht mich Sturm und wildes Meer,
so kann ich aufwärts schauen.
Es ist genug, wenn der mich hält,
der überwunden hat die Welt.
Mein Jesus bleibt doch Sieger,
mein Jesus bleibt doch Sieger.

O sagt mir nichts von Traurigkeit,
weil ich den Heiland habe,
bringt er doch Trost im tiefsten Leid
durch süße Himmelsgabe.
Ich bin voll Freuden,
weil ich still mich ihm ganz überlassen will,
bis er mich heim wird holen,
bis er wird heim mich holen."
6118;O Selger Tag;;"O selger Tag, 
da sich mein Herz
für immer mit dem Herrn verband.
Ich lag in tiefem Sündenschmerz,
da hat Er sich zu mir gewandt.

Chorus
O selger Tag, o selger Tag,
da Jesus ""Friede"" zu mir sprach.
Er nahm die schwere Last von mir,
sprach: ""Meinen Frieden geb ich dir""

O selges, Ja, das ich ihm gab,
und das Er mir ins Herze schrieb.
Gottlob, dass ich dies Zeugnis hab,
der Kindschaft zarten Geistestrieb!

Es ist geschehn!
Er ist getan, der Schritt,
der niemals noch gereut.
Gott nahm auch mich
aus Gnaden an, nun folg ich gern,
wie Er gebeut.

Mein lang geteiltes, armes Herz,
so geh zu deiner Ruhe ein!
Vergiss der Sünden bittern Schmerz.
Hier soll dein ewger Ruhplatz sein.

Der Himmel hat das Wort gehört,
der Bund ist nun auf ewig fest.
Mein Herze sonst nichts mehr begehrt.
Ich weiß, dass Er mich nie mehr lässt."
