3649;Its coming down, down / Oh Herr gieß aus;D;"O, Herr, gieß aus, aus, aus!
O, Herr, gieß aus, aus, aus!
Und der Heil'ge Geist des Herrn, Er fließt herab.
Wenn die Heil'gen ernstlich fleh'n,
wird noch Mächtiges gescheh'n
und der Heil'ge Geist des Herrn, Er fließt herab.
-------------------------------------------------------------------------
It's coming down, down, down,
it's coming down, down, down.
And the Spirit of the Lord is coming down.
When the saints began to pray
For the Lord to have His way,
Then the glory of the Lord is coming down.

Er kam herab, herab, Er kam herab, herab.
Der Menschensohn, Er kam an unser'm Tag.
Diese Braut auf Erden heut', 
des starken Engels sich erfreut,
denn die Hochzeit fand schon statt
hier auf der Erd'.
-----------------------------------------------------------------
He has come down, down, down,
He has come down, down, down.
The son of man in our day came down;
To the Bride on earth today
Came the mighty one to stay;
So the wedding now took place in our day.";
3669;I´d rather have Jesus / Than to be a King;Bb;"Ich liebe nur Jesus, nicht Güter und Geld, 
ich liebe nur Ihn, nicht den Reichtum der Welt. 
Ich liebe nur Jesus, nicht Häuser und Land, 
ich liebe nur Ihn, dessen Lieb' mich fand.
--------------------------------------------------------------
I’d rather have Jesus than silver or gold;
I’d rather be His than have riches untold;
I’d rather have Jesus than houses or lands;
I’d rather be led by His nail-pierced hand.

CHORUS
Will nicht König sein über große Macht
und gelegt in Sündenbann.
Ich liebe nur Jesus, nur Ihn allein,
weil die Welt nichts bieten kann.
--------------------------------------------------------
Than to be a king of a vast domain,
And be held in sin's dread sway;
I'd rather have Jesus than anything
This world affords today.

Ich liebe nur Jesus, nicht Menschenlob, 
ich liebe nur Ihn der mich hoch erhob. 
Ich liebe nur Jesus, nicht Ehre der Welt,
ich liebe nur Ihn, dessen Gnad' mich hält.
--------------------------------------------------------------
I’d rather have Jesus than men’s applause;
I’d rather be faithful to His dear cause;
I’d rather have Jesus than worldwide fame;
I’d rather be true to His holy name.

Ich liebe nur Jesus, der freundlich regiert,
ich liebe nur Ihn, dessen Treue mich führt. 
Ich liebe nur Jesus, des' Freude mich füllt,
ich liebe nur Ihn, der die Seele stillt.
----------------------------------------------------------------
He’s fairer than lilies of rarest bloom;
He’s sweeter than honey from out the comb;
He’s all that my hungering spirit needs;
I’d rather have Jesus and let Him lead.";
3696;Ja, das ist Gnade für mich;D;entfernt;
3864;Jesus ich liebe Dich, ich hab Dich lieb;C;"Jesus, ich liebe Dich,
ich hab' Dich lieb
über alle Dinge.
Alles in mir verlangt zu singen:
Jesus, ich hab Dich lieb'.";
3866;Jesus in mir;D;"Jesus in mir,  Jesus in mir.
Sein Wort ist in mir geoffenbart.
Und wenn noch nicht voll sichtbar,
so weiß ich ganz gewiss, dass Jesus
in mir ew'ges Leben ist.";
3904;Jesus ist Sieger über den Tod;G;"Jesus ist Sieger über den Tod,
Jesus ist Sieger, bricht alle Not.
Jesus ist Sieger in Ewigkeit,
für mich hat Jesus
den Sieg schon bereit.

Jesus ist Sieger über die Welt,
Jesus ist Sieger, der dich erhält.
Oh, werde Sieger täglich in mir,
Jesus mein Heiland,
ich weihe mich Dir!

Jesus gibt Leben,
Friede und Freud',
Jesus gibt Leben in Ewigkeit.
Jesus gibt Hoffnung
für jedes Herz,
Jesus erlöset von Sünde
und Schmerz.";
3988;Jesus You´re the sweetest / Jesus, in Deinem;F;"Jesus, in Deinem Namen ist die Kraft,
Jesus, die selbst die Blinden sehend macht. 
Der Name Jesus ist erfüllt von Herrlichkeit,
Jesus, Gott von Ewigkeit.
------------------------------------------------
Jesus, You´re the sweetest name of all,
Jesus, You always hear me when I call.
Jesus, You picked me up each time I fall,
You´re the sweetest, the sweetest name of all.

Jesus, in Deinem Namen liegt das Heil.
Jesus, mein Lob wird Dir allein zuteil.
Oh, Jesus, Du bist die Gerechtigkeit,
Leben in alle Ewigkeit.
------------------------------------------------
Jesus, how I love to praise Your name,
Jesus, You´re still the first, the last, the same.
Jesus, You died and took away my sins.
You´re the sweetest, the sweetest name of all.

Jesus, mein König, der bald wiederkehrt.
Jesus, mein Herz nur Dich allein begehrt.
Dem Namen Jesus singen wir für alle Zeit.
Jesus, Herr, der Herrlichkeit.
-------------------------------------------------
Jesus, You´re the soon and coming king,
Jesus, we need the love that You can bring.
Jesus, we lift our voices up and sing:
You´re the sweetest, the sweetest name of all.";
4065;Just a closer walk / I am weak but Thou art strong;G;"Ich bin schwach doch Du bist stark,
Jesus, halt' mich in der Gnad';
dass ich geh' auf Deinem Pfad,
dass ich geh', treuer Herr, nur mit Dir.
--------------------------------------------------------
I am weak but Thou art strong,
Jesus keep me from all wrong;
I'll be satisfied as long,
As I walk let me walk close to Thee.

Chorus
Immer näher, Herr, zu Dir,
ist mein Flehen stets allhier;
Täglich wandeln nur mit Dir,
das gewähr', o Herr, bitten wir.
-------------------------------------------------
Just a closer walk with Thee,
Grant it, Jesus, is my plea;
Daily walking close to Thee,
Let it be, dear Lord, let it be.

In der Welt voll Sorg' und Tod,
Wer ist da, der hilft aus Not?
Wer gibt Fried' und neuen Mut?
Du allein, Jesus, Herr, nur allein.
-----------------------------------------------------
Thru this world of toil and snares,
If I falter, Lord, who cares?
Who with me my burden shares?
None but Thee, dear Lord, none but Thee.

Wenn mein Leben hier vorbei,
bin ganz sicher, dass Er treu;
führt Er mich zum gold'nen Strand,
preis sei Ihm, ins verheißene Land.
----------------------------------------------------
When my feeble life is o'er,
Time for me will be no more;
Guide me gently, safely o'er,
To Thy kingdom shore, to Thy shore.";
4086;Just beyond the veil / Hinter den Vorhang zu gehn;D;"Hinter den Vorhang zu geh'n,
Deine Schönheit zu seh'n,
auf Dein Angesicht zu schau'n;
das ist's, wonach ich mich seh'n.
------------------------------------------------
Just beyond the veil,
I long to see Your face,
Just to see Your beauty there,
Just beyond the veil.	

Wunderschön bist Du,
wunderschön bist Du!
Lass mich heute vor Dir steh'n,
Deine Schönheit zu seh'n.
--------------------------------------------
Beautiful You are,
Beautiful You are,
Beautiful You are, You are.
Beautiful You are.

Friedensfürst bist Du,
Friedensfürst bist Du.
Friedensfürst bist Du, allein,
Du bist der Friedensfürst.
------------------------------------------
You're the Prince of Peace,
You're the Prince of Peace,
You're the Prince of Peace, You are.
You're the Prince of Peace.";
4293;Kommt Zu Mir;C;entfernt;
4429;Lang nach eines Lichtes Sommer;G;"Lang nach eines Lichtes Schimmer
spähten wir in dunkler Nacht,
doch wir sanken tiefer immer
in der Sünde finstre Macht.
O wo ist die starke Rechte,
voll von heilger Gotteskraft,
die aus einem Sündenknechte
einen neuen Menschen schafft?

Siehe da, voll Huld und Gnaden
Kam der Heiland Jesus her.
Sprach: Ich heile deinen Schaden,
komm und sündige nicht mehr!

Chorus
Jesu Liebe kann erretten,
Seine Hand ist stark und treu,
Er zerbricht der Sünde Ketten
und macht alles, alles neu.

Unsre Güter, unsre Gaben
hatte Sündendienst verheert;
Mut und Hoffnung war begraben,
unsre beste Kraft verzehrt.

Ach, was konnten wir Ihm geben,
der so viel für uns getan!
Nichts als ein verarmtes Leben
doch Er sah es gnädig an.

Und die Herzen, schuldbeklommen,
die wir Armen Ihm gebracht,
hat Er liebreich angenommen
und sie rein und still gemacht.

Herr, mit Deinem Angesichte
leite Du uns immerfort,
dass sich unser Wandel richte 
nur nach Deinem Sinn und Wort!"
4433;Langt bort om himmel blånar;;"Langt bort om himmel-blånar,
lengre enn soler går,
høgre enn stjerner strålar
den barnlege bøna når.
ånda frå skuggestrender lyfter
sitt vengepar, bankar på himmelporten
og søkjer sin heim, sin far.

Verdlaust vert alt i verda, 
maktlaus kvar jordisk ven,
sjela fin ro og feste åleine i himmelen.
såraste sorg skal stilna, 
mørke til morgon snu,
bare du trutt vil vandra
på bøna si himmelbru.

Veikaste barn som vender
hjarta til Herren sterk,
maktar langt meir enn kjemper
som lit på sitt eige verk.
måtte me alltid minnast
kor me i verda går,
at til Guds eige hjarta
den barnlege bøna når."
4440;Lass Dein Lebenswasser;F;"Lass Dein Lebenswasser 
nun strömen durch mich. 
Lass den Heil'gen Geist 
jetzt kommen, nimm mich mit.
Jede Sorge, jede Last, 
die mich bedrückt,
werfe ich auf Dich, 
denn Du sorgst für mich.

Jesus, Jesus, Jesus,
Jesus, Jesus, Jesus."
4441;Lass Deine Liebe durch mich strömen;D;"Lass Deine Liebe durch mich strömen, 
lass Deine Liebe durch mich strömen,
lass Deine Liebe, o HErr strömen 
durch mich, ich bitte Dich.
Lass Deine Liebe durch mich strömen,
lass Deine Liebe durch mich strömen, 
lass Deine Liebe, o HERR, 
strömen durch mich.

Lass Deinen Frieden durch mich strömen, 
lass Deinen Frieden durch mich strömen,
lass Deinen Frieden, o HErr strömen 
durch mich, ich bitte Dich.
Lass Deinen Frieden durch mich strömen,
lass Deinen Frieden durch mich strömen, 
lass Deinen Frieden, o HERR, 
strömen durch mich.

Lass Deine Gnade durch mich strömen, 
lass Deine Gnade durch mich strömen,
lass Deine Gnade, o HErr strömen 
durch mich, ich bitte Dich.
Lass Deine Gnade durch mich strömen,
lass Deine Gnade durch mich strömen, 
lass Deine Gnade, o HERR, 
strömen durch mich.

Lass Deine Ruhe durch mich strömen, 
lass Deine Ruhe durch mich strömen,
lass Deine Ruhe, o HErr strömen 
durch mich, ich bitte Dich.
Lass Deine Ruhe durch mich strömen,
lass Deine Ruhe durch mich strömen, 
lass Deine Ruhe, o HERR, 
strömen durch mich.

Lass Deinen Segen durch mich strömen, 
lass Deinen Segen durch mich strömen,
lass Deinen Segen, o HErr strömen 
durch mich, ich bitte Dich.
Lass Deinen Segen durch mich strömen,
lass Deinen Segen durch mich strömen, 
lass Deinen Segen, o HERR, 
strömen durch mich."
4442;Lass den Heilgen Geist ziehn ein;Bb;"Wärst du gern für immer 
von der Sünde frei?
Willst du, dass der Heilge
Geist dein Führer sei?
Weih dich Gott aufs neue,
traue Ihm allein:
Laß den Heilgen Geist ziehn ein.

Chorus
Lass den Heilgen Geist ziehn ein,
Lass den Heilgen Geist ziehn ein.
Weih dich Gott aufs neue, 
traue Ihm allein:
Lass den Heilgen Geist ziehn ein.

Soll der Geist der Freude
stets im Herzen sein?
Soll von Furcht und Zweifel
Er dich stets befrein?
Weih dich Gott aufs neue, 
traue Ihm allein:
Laß den Heilgen Geist ziehn ein.

Soll in deiner Seele 
Himmelsfreude glühn?
Soll sie ganz verzehren
eignes Tun und Mühn?
Weih dich Gott aufs neue, 
traue Ihm allein:
Laß den Heilgen Geist ziehn ein.

Willst du Kraft von oben,
Geisteskraft vom Herrn?
Seelen dem zuführen,
der sie rettet gern?
Weih dich Gott aufs neue, 
traue Ihm allein:
Laß den Heilgen Geist ziehn ein."
4443;Lass es einfach so stehen;;"Es gibt Zweifler die versuchen
Gottes Wort zu verdreh`n.
Lass es einfach so steh`n
Lass es einfach so steh`n.
Nicht länger diese Zeile
oder Stelle sie nehm`n,
doch ändre`s nicht
lass es so steh`n.

CHORUS
Lass es einfach so steh`n,
Gott`s gesegnetes Wort,
dessen Sohn für das Böse
uns Versöhnung gab.
Jedes Wort, jede Zeil
spricht von göttlicher Güt`.
Doch ändre`s nicht,
lass es so steh`n!

Diese Botschaft ist die Speis`,
die Offenbarung des Wort`s,
lass es einfach so steh`n,
lass es einfach so steh`n.
Gottes Stimm` durch Sein`
Propheten, die wir haben gehört,
doch ändre`s nicht
lass es so steh`n.

Die Warnung die Er gab, wer
will noch schenken Gehör?
Lass es einfach so steh`n,
lass es einfach so steh`n.
Gottes einfache Botschaft,
ja was wollen wir mehr,
doch ändre`s nicht,
lass es so steh`n."
4444;Lass mich geh'n;G;"CHORUS
Lass mich geh'n mit Dir, Jesus,
lass niemals mehr mich allein.
Denn ohne Dich kann ich nie mehr
den Himmel einst nennen mein Heim.

Ich fand Dich, als ich so betrübt war.
Ich fand Dich, als ich war allein.
Du halfst mir, als niemand mehr konnte
und wusste nicht aus oder ein.

Ich war auf dem Berge mit Jesus,
ich war in dem Tale, so tief.
Und niemals hat Er mich verlassen,
drum bring' ich die Sorgen zu Ihm."
4445;Lass Mich Wandeln;;"CHORUS
Lass mich wandeln mit Jesus,
oh, Herr, lass mich niemals allein,
denn ohne dich, oh, Herr Jesus,
wird die Herrlichkeit niemals mein Heim.

Er fand mich in tiefer Verzweiflung,
er fand mich einsam, ohne Glück.
Er fand mich als niemand konnt` helfen,
in Sünde und Welt ganz verstrickt.

Ich bin über Höhen gewandelt,
durch Täler der Tränen hindurch;
und niemals hat er mich verlassen,
nie hat seine Hand mich enttäuscht."
4446;Lasst Die Botschaft;;"Lasst die Botschaft weithin schallen,
Berg und Tal lasst wiederhallen;
Gott vergibt den Sündern allen,
komm, komm und sieh!"
4447;Lasst die kleinen Lichter brennen;G;"Leuchtend strahlt des Vaters Gnade 
aus dem ober'n Heimatland; 
doch uns hat Er anvertrauet 
kleine Lichter an dem Strand.

CHORUS
Lasst die kleinen Lichter brennen,
lasst sie strahlen durch die Nacht,
dass noch manch verirrter Schiffer
sicher werde heimgebracht!

Unser Weg war fern vom Lichte, 
unser Herz in Schuld und Qual, 
doch aus Jesu Angesichte 
leuchtete der Liebe Strahl.

Dunkel ist die Nacht der Sünde, 
schaurig klingt der Wogen Lied. 
Manches Auge sucht voll Sehnsucht, 
ob's am Strande Lichter sieht.

Jesus hat uns ausgesendet, 
wie der Vater Ihn gesandt, 
dass die Liebe Gottes strahle dort, 
wo sie noch unbekannt.

Lass dein Licht doch nicht verlöschen, 
sonst, vielleicht zu dieser Stund', 
weil es nicht den Hafen findet, 
sinkt ein Schifflein auf den Grund."
4448;Lasst Die Küstenfeuer Brennen;;"Leuchtend strahlt
des Vaters Gnade
aus dem obern Heimatland,
doch uns hat er anvertrauet
Rettungslichter längs dem Strand.

CHORUS
Lasst die Küstenfeuer brennen,
lasst sie leuchten weit hinaus,
denn sie zeigen manchem Schiffer
sicherlich den Weg nach Haus.

Dunkel ist die Nacht der Sünde,
schaurig klingt der Wogen Lied.
Manches Auge sucht voll Sehnsucht,
ob`s am Strande Lichter sieht.

Lass dein Licht noch nicht verlöschen,
sonst vielleicht zu dieser Stund`,
weil es nicht den Hafen findet,
sinkt ein Schifflein auf den Grund."
4452;Lasten Sie Fallen;;"Ist dein Herz voll Sorgen
und Schmerz,
die bedrücken dein Herz?
Lasten, sie fallen auf Golgatha,
Jesus ist immer nah.

CHORUS
Lasten, sie fallen auf Golgatha,
Golgatha, Golgatha.
Lasten, sie fallen auf Golgatha,
Jesus ist immer nah.

Er hilft dir, vertraue auf Ihn,
gib dich völlig Ihm hin.
Lasten, sie fallen auf Golgatha,
Jesus ist immer nah."
4499;Learning to lean / Lernen zu ruhn;F;"Lernen zu ruh'n, lernen zu ruh'n.
Ich lerne zu ruh'n in Jesus.
Bekomme mehr Kraft,
als ich je gedacht.
Ich lerne zu ruh'n in Jesus.
--------------------------------------------------------------------
Learning to lean, learning to lean.
I'm learning to lean on Jesus.
Finding more power than I'd ever dreamed.
I'm learning to lean on Jesus.";
4512;Leg sie ab die schwere Last;A;"O leg' sie ab, die schwere Last,
die du so lang getragen hast!
Jesus gibt Ruh', o glaub' es nur!
Sein Blut gab Er für dich und mich."
4513;Lehre mich wandeln;;"O lehre mich wandeln 
wie Henoch mit Gott,
mein Heiland, bei Tag
und bei Nacht,
zu ruhen in Deiner 
glückseligen Näh,
getragen von göttlicher Macht.

Chorus
O Herrlichkeitsweg, 
mein Jesus Du selbst
bist nun Überwinder in mir,
Du wandelst und lebst,
Du streitest und siegst,
o ewig Anbetung sei Dir!

Befreit von der Sünde, 
befreit von der Furcht,
der Vater, Er lächelt mir zu.
O Wunder der Gnade, 
mein Retter, mein Herr,
Du hast es vollbracht, o nur Du!

Gelöst von der Erde, 
gekreuzigt der Welt,
ein Werkzeug des Herrn nur allein,
nichts wissen und streben, 
nichts wollen und tun,
als Ihm nur zur Ehre zu sein.

O Anbetung Dir, 
Deinem Namen die Ehr,
so lange hier währet die Zeit;
ich ruhe und staune und bete Dich an
und schaue Dich in Ewigkeit."
4515;Leise und inniglich;;"Leise und inniglich
mahnet der Heiland,
ruft die Verlor`nen zum Heil.
Steht vor der Türe
des Herzens und wartet.
Öffne Ihm, Er ist Dein Heil.

CHORUS
Komm heim, komm heim!
Seele vernimm es:
Komm heim!
Horch wie Dein Heiland
Dich flehentlich rufet:
Gib` Ihm Dein Herze,
komm heim!

Kannst Du noch warten?
Ach, siehe, Dein Heiland
flehet so innig und warm.
Suchet so emsig
Sein irrendes Schäflein.
Warten bringt ewiglich Harm.

Flüchtig sind hier
uns`re Stunden und Tage,
bald ist die Arbeit getan.
Sieh` wie die Finsternis
mächtig hereinbricht.
Bald bricht die Ewigkeit an.

Oh, welche Wunder
der göttlichen Liebe,
die uns in Jesus erscheint:
Kennst Du, mein Bruder,
den Retter der Seelen?
Ist Er Dein Heiland und Freund?"
4520;Lernen Zu Ruh'n;;"Lernen zu ruh'n, lernen zu ruh'n.
Ich lerne zu ruh'n in Jesus.
Bekomme mehr Kraft,
als je ich gedacht.
Ich lerne zu ruh'n in Jesus."
4553;Let me walk with You / Lass mich wandeln mit Jesus;F;"CHORUS
Lass mich wandeln mit Jesus,
o, Herr, lass mich niemals allein,
denn ohne Dich, o, Herr Jesus,
wird die Herrlichkeit niemals mein Heim.
-----------------------------------------------------------
Let me walk with You, Jesus,
Don't ever leave me alone.
For without You I could never,
No, never make heaven my home.

Er fand mich in tiefer Verzweiflung,
Er fand mich einsam, ohne Glück.
Er fand mich als niemand konnt' helfen,
in Sünde und Welt ganz verstrickt.
-------------------------------------------------------------
You found me when I was so lonely.
You found me when I was so blue.
You found me
When no one could help me,
When no one knew just what to do.

Ich bin über Höhen gewandelt,
durch Täler der Tränen hindurch;
und niemals hat Er mich verlassen,
nie hat Seine Hand mich enttäuscht.
---------------------------------------------------------
I've been on the mountain with Jesus,
I've been in the valley so low.
And never one time has He failed me.
To Him with my troubles I go.";
4577;Let the lower lights be / Leuchtend strahlt des;F;"Leuchtend strahlt des Vaters Gnade
aus dem obern Heimatland,
doch uns hat er anvertrauet
Rettungslichter an dem Strand.
-----------------------------------------------------
Brightly beams our Father's mercy
From His lighthouse evermore,
But to us He gives the keeping
Of the lights along the shore.

CHORUS
Lasst die Küstenfeuer brennen,
lasst sie leuchten weit hinaus,
denn sie zeigen manchem Schiffer
sicherlich den Weg nach Haus.
---------------------------------------------------
Let the lower lights be burning!
Send a gleam across the wave!
Some poor fainting, struggling seaman
You may rescue, you may save.

Dunkel ist die Nacht der Sünde,
schaurig klingt der Wogen Lied.
Manches Auge sucht voll Sehnsucht,
ob's am Strande Lichter sieht.
--------------------------------------------------------
Dark the night of sin has settled,
Loud the angry billows roar;
Eager eyes are watching, longing,
For the lights along the shore.

Lass dein Licht noch nicht verlöschen,
sonst vielleicht zu dieser Stund',
weil es nicht den Hafen findet,
sinkt ein Schifflein auf den Grund.
-----------------------------------------------------------
Trim your feeble lamp, my brother;
Some poor sailor tempest tossed,
Trying now to make the harbour,
In the darkness may be lost.";
4629;Liebe Ohne Schranken;;"O Liebe ohne Schranken
in Gottes Heilsgedanken:
Der Sohn erscheint
als Mensch in unsrer Niedrigkeit;
Als Kindlein liegt im Stalle
der Herrscher über alle.

Chorus
Liebe, sei gelobt in alle Ewigkeit, 
o, Liebe, sei gelobt in alle Ewigkeit.

Um unsern Fluch zu tragen,
lässt Er ans Kreuz sich schlagen
Den Übeltätern gleich,
der Schmach, dem Tod geweiht.
Er stirbt , um uns zu retten
und lässt ins Grab sich betten.

Der Herr erwacht; Er lebet!
Die Erde freudig bebet;
Dem Grab entsteigt der Held
als Sieger in dem Streit.
Er lebt, um uns zu geben
Sein Auferstehungsleben.

Der Herr ist nun erhoben
zur Rechten Gottes droben
Und bittet dort für uns
den Vater allezeit.
Ihm ist an uns gelegen,
Er will uns nähren, pflegen.

Er will, dass wir auf Erden schon
eines mit Ihm werden,
und machet unser Herz
zur Wohnung sich bereit.
Da will Er wirken, walten,
von Sünden rein uns halten.

Bald wird der Herr erscheinen
und uns um Ihn vereinen;
Dann herrschen wir mit Ihm
in seiner Herrlichkeit.
Mit Thronen und mit Kronen
wird Er die Seinen lohnen."
4703;Lob und Dank;;"Lob und Dank, Lob und Dank,
Lob und Dank,
Gottes Kinder sagen immer:
Lob und Dank.

Jedes Weh wurde gut
durch des Heilandes Blut.
Lob und Dank, Lob und Dank,
Lob und Dank,
Gottes Kinder sagen immer:
Lob und Dank."
4704;Lob und Dank, Lob und Dank;G;"Lob und Dank, Lob und Dank,
Lob und Dank,
Gottes Kinder sagen immer:
Lob und Dank. (2x)

Jedes Weh wurde gut
durch des Heilandes Blut.
Lob und Dank, Lob und Dank,
Lob und Dank,
Gottes Kinder sagen immer:
Lob und Dank!";
4705;Lob Und Ehr Dem Höchsten Gut;;"Sei Lob und Ehr dem höchsten Gut,
dem Vater aller Güte,
dem Gott, der alle Wunder tut,
dem Gott, der mein Gemüte 
mit Seinem reichen Trost erfüllt,
dem Gott, der allen Jammer stillt.
Gebt unserm Gott die Ehre!

Es danken Dir die Himmelsheer, 
O Herrscher aller Thronen,
und die auf Erd, in Luft und Meer
in Deinem Schatten wohnen,
die preisen Deine Schöpfermacht,
die alles also wohl bedacht.
Gebt unserm Gott die Ehre!

Was unser Gott geschaffen hat, 
das will Er auch erhalten.
Darüber will Er früh und spät
Mit Seiner Gnade walten
In Seinem ganzen Königreich
Ist alles recht und alles gleich.
Gebt unserm Gott die Ehre!

Ich rief zum Herrn in meine Not:
Ach, Gott, vernimm mein Schreien!
Da half mein Helfer mir vom Tod,
ließ Trost mir angedeihen.
Drum dank, ach Gott, drum dank ich Dir,
Ach danket, danket Gott mit mir.
Gebt unserm Gott die Ehre!

Der Herr ist ncoh und nimmer nicht
Von Seinem Volk geschieden;
Er bleibet ihre Zuversicht, 
Ihr Segen, Heil und Frieden.
Mit Mütterhänden leitet Er
Die Seinen stetig hin und her.
Gebt unserm Gott die Ehre!

So kommet vor Sein Angesicht,
Mit Jauchzen Dank zu bringen,
Bezahlt Ihm die gelobte Pflicht
Und lasst uns fröhlich singen:
Gott hat es alles wohl bedacht
Und alles, alles recht gemacht:
Gebt unserm Gott die Ehre!"
4707;Lobe Den Herren;;"Lobe den Herren, 
den mächtigen König der Ehren,
Lob ihn, o Seele, vereint 
mit den himmlischen Chören!
Kommet zu Hauf, Psalter und Harfe,
wacht auf, lasset den Lobgesang hören!

Lobe den Herren, 
der alles so herrlich regieret,
der wie auf Flügeln des Adlers 
dich sicher geführet,
der dich erhält, wie es dir selber gefällt;
hast du nicht dieses verspüret?

Lobe den Herren, 
der künstlich und fein dich bereitet,
der dir Gesundheit verliehen, 
dich freundlich geleitet:
in wie viel Not hat nicht der gnädige Gott 
über dir Flügel gebreitet!

Lobe den Herren, 
der deinen Stand sichtbar gesegnet,
der aus dem Himmel 
mit Strömen der Liebe geregnet;
Denke daran, was der Allmächtige kann,
der dir mit Liebe begegnet!

Loben den Herren, 
was in mir ist, lob Seinen Namen!
Alles, was Odem hat, 
lobe mit Abrahams Samen!
Er ist dein Licht; Seele vergiß es ja nicht,
Lob ihn in Ewigkeit! Amen."
4708;Lobe den Herrn meine Seele;;"Lobe den Herrn, meine Seele 
und was in mir ist, Seinen heiligen Namen.
Lobe den Herrn, meine Seele
und vergiss nicht, was Er dir Gutes getan hat.

Der dir alle deine Sünden vergibt
und all` deine Gebrechen heilt,
der dein Leben vom Verderben erlöst.
Der dir alle deine Sünden vergibt
und all` deine Gebrechen heilt,
der dich krönt mit Gnade und Barmherzigkeit.

Lobe den Herrn, meine Seele 
und was in mir ist, Seinen heiligen Namen.
Lobe den Herrn, meine Seele
und vergiss nicht, was Er dir Gutes getan hat.

Barmherzig und gnädig ist Er,
geduldig und von grosser Güte,
der dein Leben vom Verderben erlöst.
Barmherzig und gnädig ist Er,
geduldig und von grosser Güte,
der dich krönt mit Gnade und Barmherzigkeit.

Lobe den Herrn, meine Seele 
und was in mir ist, Seinen heiligen Namen.
Lobe den Herrn, meine Seele
und vergiss nicht,
was Er dir Gutes getan hat,
und vergiss nicht,
was Er dir Gutes getan hat."
4710;Lobt Froh Den Herrn Ihr Jugendlichen Chöre;;"Lobt froh den Herrn,
ihr jugendlichen Chöre!
Er höret gern ein Lied
zu Seiner Ehre.
Lobt froh den Herrn,
lobt froh den Herrn!

Es schallt empor
zu Deinem Heiligtume
Aus unserm Chor
ein Lied zu Deinem Ruhme,
Du, der sich Kinder auserkor.

Vom Preise voll,
laß unser Herz Dir singen!
Das Loblied soll
zu Deinem Throne dringen,
das Lob,
das unsrer Seel entquoll.

Wir stammeln hier,
doch hörst Du unser Lallen
Und lässt es Dir
in Gnaden wohl gefallen.
Dir jauchzen wir, Dir singen wir.

Einst kommt die Zeit,
wo wir auf tausend Weisen
O Seligkeit! Dich, unsern Vater, 
preisen von Ewigkeit zu Ewigkeit."
4711;Lobt Gott Ihr Christen;;"Lobt Gott, ihr Christen, allzugleich
In Seinem höchsten Thron,
Der heut aufschließt Sein Himmelreich
Und schenkt uns Seinen Sohn.
Schenkt uns Seinen Sohn, 
und schenkt uns Seinen Sohn.

Er kommt aus Seines Vaters Schoß
Und wird ein Kindlein klein;
Liegt dort elend, nackt und bloß
In einem Krippelein.
Einem Krippelein,
in einem Krippelein.

Er äußert Sich all Seiner G'walt, 
wird niedrig und gering
und nimmt an Sich
eines Knechts Gestalt,
der Schöpfer aller Ding.
Schöpfer aller Ding,
der Schöpfer aller Ding.

Er wechselt mit uns wunderlich,
Fleisch und Blut nimmt Er an
Und gibt uns in Sein Vatersreich 
die klare Gottheit dran.
Klare Gottheit dran,
die klare Gottheit dran.

Er wird ein Knecht und ich ein Herr,
das mag ein Wechsel sein.
Wie könnt es doch sein freundlicher, 
das Herze Jesulein.
Herze Jesulein,
das Herze Jesulein.

Heut schließt Er wieder auf die Tür
Zum schönen Paradies, 
der Cherub steht nicht mehr dafür;
Gott sei Lob, Ehr und Preis.
Sei Lob, Ehr und Preis, 
Gott sei Lob, Ehr und Preis!"
