1;Cantai ao Senhor cânticos novos;E;"Cantai ao Senhor cânticos novos,
Porque Ele fez grandes maravilhas (2X)

Levantai a voz e aplaudi,
Cantemos salmos ao Senhor (2X)

Direi do Senhor, Ele é Meu Deus,
Meu Refúgio e Minha fortaleza (2X)

Bendiz ó minha alma ao Senhor,
Bendiz ao Seu Santo Nome (2X)

O Senhor é a Força da minha vida,
De quem me recearei? (2X)

Elevo os meus olhos para os montes,
De onde virá o meu socorro? (2X)"
2;Irmão como estão;E;"Irmãos como estão? Estamos bem! (3X)
Com o Nosso Deus no coração!

Irmãs como estão? Estamos bem! (3X)
Com o Nosso Deus no coração!

Posso cantar e gritar: Oh! Glória a Deus! (3X)
Com o Nosso Deus no coração!

Não há, portanto, agora, Condenação! (3X)
Com o Nosso Deus no coração!"
3;Dizemos Amém;E;"Dizemos: Amém, amém, amém! (3X)
Dizemos: Amém!

Dizemos: Amém, amém, amém! (3X)
Dizemos: Amém!

Eu sei que sua Graça é por mim! (3X)
Eu sei que é a Graça!

Eu sei que o Seu amor está aqui! (3X)
Eu sei que é o amor!"
4;A tua Graça;E;"A Tua graça é melhor que a vida.
A Tua graça é melhor que a vida.
Meus lábios Te louvam e assim bendirei,
E em Teu nome minhas mãos levantarei!"
5;Foi Graça;E;"Quando terminar esta vida, e lá no céu eu chegar
Haverá uma multidão de irmãos
Esperando pra me abraçar,
E perguntarão a uma voz, Voltados para mim:
Oh conta-nos como você irmão,
Venceu e chegou aqui
E falarei, e cantarei, foi Jesus que me salvou
Que por este pecador a si mesmo se entregou

Foi graça, graça, super abundante graça
Graça, graça, preciosa e doce graça
Foi graça irmão, graça irmão
Eu vos digo que foi assim
Foi só pela graça de Jesus
Que eu venci e cheguei aqui"
6;Cristo tem tomado minha vida;E;"Cristo tem tomado minha vida,
Tem tomado minha vida e nunca mais deixara
Cristo tem tomado minha vida,
Tem tomado minha vida e nunca mais deixara
Perdido estava eu, mas Cristo me encontrou
Porque Cristo tem tomado minha e nunca mais deixara."
7;Ele me conforta;E;"Atravessarei os montes e as pedras pularei
Com o meu Senhor ao lado minha cruz pesada leve
sentirei

Ele me conforta, Ele me anima com Ele vencerei
Ele me conforta, Ele me anima com Ele vencerei

Mesmo se houver barreiras e o pavor me sobrevier
Ele estando ao meu lado nada temerei com Ele vou
subir

E fim no fim da jornada a vitória eu terei
Vou morar no Lar Eterno e ali jamais lutas eu terei"
8;Eu pressinto que algo grae;E;"Eu pressinto que algo grande está a caminho.
Porque eu sinto que algo bom está aqui
A promessa de um estrondo desde os céus,
Oh! Irmão, qualquer dia pode ser.

Se o crente se humilha e clama a Ele.
E do céu em fé, espera enquanto ora,
Eu pressinto que algo bom está a caminho.
Oh! Irmão, qualquer dia pode ser."
9;Todos devem Saber;E;"Todos devem saber (TRIS)
Quem é Jesus!
Ele é o lírio dos Vales!
A estrela da manhã
O escolhido entre os milhares
Todos devem saber!

Todos devem conhecer (TRIS)
Quem é Jesus!
Ele é o lírio dos Vales!
A estrela da manhã
O escolhido entre os milhares
Todos devem conhecer!"
10;Igreja Primitiva;E;"Esta igreja é A primitiva,
E sempre foi a Igreja do Senhor.
Por isso ela é Uma igreja Viva,
E revestida do Consolador.

(BIS) Ela não cai, Não cai, não cai!
Porque Jesus do Meio dela não Sai

Esta igreja é A primitiva,
E sempre foi A igreja de Poder.
Trazendo sempre Uma mensagem Viva,
Pra converter todo que nele crer.

Esta igreja marcha Triunfante,
Porque existe Um povo Lutador.
Vivendo sempre Em Despertamento,
E combatendo contra o tentador

Esta igreja Quando se reúne,
Para buscar a Deus em Oração.
O fogo desce abrasadoramente
Trazendo gozo e Purificação.

Irmãos amados Vamos batalhar,
Não desanime Com as lutas Não,
Pois brevemente Cristo voltará
Nos levará Para a feliz Sião."
11;Eu quero andar nas ruas de ouro;E;"Eu quero andar nas ruas de ouro com Jesus (2X)
Eu quero andar nas ruas de ouro (2X)
Eu quero andar nas ruas de ouro com Jesus
E lá na nova Jerusalém (3x)
Eu quero andar nas ruas de ouro com Jesus"
12;Meu meu meu;E;"Meu, meu, meu, Jesus é meu (2X)
Dia a dia Ele é meu Salvador
Meu, meu, meu, Jesus é meu."
13;Eco de Aleluia;E;"Estão ouvindo este eco de aleluias
Este barulhão de glórias a Deus
Quando aqui na terra se findar
Ainda continua lá no céu

Eu conheço muita gente que são como fariseus
Não gostam de aleluias e proíbem glórias a Deus
Irmãos queremos ver, onde os tais vão se esconder
Quando Cristo lá no céu aparecer

Por isto meus irmãos busquem o poder de Deus
Não olhem para o mundo nem escutem fariseus
Dai glória e aleluia, Jesus já vem aí
Este povo barulhento vai subir"
14;Jesus Convida;E;"Jesus convida pra com Ele viajar,
Esta viagem eu não posso rejeitar
Viagem longa é muito longa,
Mas é com Ele que eu quero viajar.

Jesus convida pra com Ele viajar,
Esta viagem eu não posso rejeitar
Tem água viva, tem pão da vida
Tem uma mesa para os salvos saciar

Jesus convida pra com Ele viajar,
E lá no céu um lugar foi preparar,
Mansão celeste pra Noiva eleita
Que brevemente no céu vai descansar"
15;Esta alegria não vai mais sair;E;"Esta alegria não vai mais sair (3x)
De dentro do meu coração.
O fogo cai, o fogo cai,
O salvo em Cristo sabe para onde vai.
O fogo cai, o fogo cai,
O salvo em Cristo sabe para onde vai."
16;Subindo;E;"Subindo, subindo,
Subindo para o céu eu vou.
Tristeza não vai comigo
Porque Jesus Cristo me salvou:
Joguei a tristeza fora
E com Jesus para o céu eu vou!"
17;É isto que me faz cantar;E;"É isto que me faz cantar (2X)
Dos meus pecados livres estou e para o céu eu vou
É isto que me faz cantar
Ao mundo vou anunciar (2X)
Que Cristo salva o pobre pecador com seu amor
É isto que me faz cantar"
18;Eu tenho um amigo que me ama;E;"Eu tenho um amigo que me ama
Que me ama, que me ama
Eu tenho um amigo que me ama
Seu nome é Jesus

Jesus, Jesus, Seu nome é Jesus
Jesus, Jesus, Seu nome é Jesus

Eu tenho um amigo que guia
Me guia, me guia
Eu tenho um amigo que me guia
Seu nome é Jesus

Eu tenho um amigo que guarda
Me guarda, me guarda
Eu tenho um amigo que me guarda
Seu nome é Jesus"
19;Meu coração contente esta;E;"Meu coração contente está
Meu coração contente está
Porque o Senhor já me salvou

Meu coração contente está
Meu coração contente está
Porque o Senhor já me salvou

Oh quão feliz, feliz, feliz
Se sente a alma com Jesus
Com a paz, que nenhum outro pode dar

Oh quão feliz, feliz, feliz
Se sente a alma com Jesus
Com a paz, que nenhum outro pode dar"
20;Eu só confio no Senhor;E;"Eu só confio no Senhor
Que não vai falhar
Eu só confio no Senhor
Vivo a cantar
Se o sol chegar a escurecer
E céu tornar
Eu só confio no Senhor
Que não vai falhar

Posso confiar
Posso confiar
Que lá do céu
Cristo vai me dá
Se o sol chegar a escurecer
E o céu tornar
Eu só confio no Senhor
Que não vai falhar"
21;A minh’alma está cheia de paz;E;"A minh'alma está cheia de paz
A minh'alma está cheia de paz
Tenho gozo em viver, alegria em dizer
A minh'alma está cheia de paz"
22;Deus está neste lugar;E;"Uma coisa estou sentindo aqui agora
Que Deus está neste lugar
Uma coisa estou sentindo aqui agora
Que Deus está neste lugar
Deus está neste lugar
Deus está neste lugar
O espírito santo me revela
Que Deus está neste lugar"
23;Eu tenho paz;E;"Eu tenho paz como um rio (2X).
Eu tenho paz como um rio, em minha alma.

Eu tenho amor como um rio (2X).
Eu tenho amor como um rio, em minha alma.

Eu tenho paz, amor e vida como um rio (2X)
Eu tenho paz, amor e vida como um rio, em minha
alma.

Eu tenho paz, amor e vida como um rio (2X)
Eu tenho paz, amor e vida como um rio, em minha
alma."
24;Cristo tem tomado minha vida;E;"Cristo tem tomado minha vida
Tem tomado minha vida
E nunca mais deixará
Cristo tem tomado minha vida
Tem tomado minha vida
E nunca mais deixará
Perdido estava eu, mas cristo me salvou
Porque Cristo tem tomado minha vida e nunca mais
deixará"
25;Quando me lembro de meu bom Jesus;E;"Quando me lembro do meu bom Jesus
E como sofreu, o meu rei,
Quero servi-lo cada vez melhor,
Eu nunca a Jesus deixarei.

(BIS) Não! Não! Não, não, não.
Eu nunca a Jesus deixarei.

Lá no calvário sofreu Jesus
Ali penduraram, meu rei,
Quero servi-lo cada vez melhor,
Eu nunca a Jesus deixarei."
26;Quão bom e quão maravilho é;E;"Quão bom e quão maravilhoso é
Que os irmãos vivam em união
Quão bom e quão maravilhoso é
Que os irmãos vivam em união

Aperte a mão do seu irmão, E de um sorriso pra ele (2X)"
27;Batalha não é batalha;E;"Batalha não é batalha, se não surgem as provas
Se o inimigo não se levanta, batalha não é batalha

Com Jesus, eu irei, ganharei a batalha (2X)

Eu ganharei a batalha, tu ganharás a batalha
Ele ganhará a batalha, nós ganharemos a batalha"
28;Que Calor é este;E;"Que calor é este em volta do altar? (3x)
É o poder de Deus
Que está neste lugar,
É o poder de Deus
Que está neste lugar."
29;O crente que não ora não é feliz;E;"O crente que não ora, não é feliz
Não é feliz, não é feliz
O crente que não ora não é feliz
Não é feliz, não é feliz

Vamos seguindo a Jesus com perfeição
Para termos a certeza de morar lá em Sião
Porque foi ele quem deu a salvação
O crente que é salvo vive em oração"
30;Vamos encher esta casa de alegria;E;"Vamos encher essa casa de alegria
Vamos cantar e nunca murmurar
Vamos falar de Cristo noite e dia
E na igreja alegria espalhar"
31;As minhas mãos estão cheias;E;"As minhas mãos estão cheias das tuas bençãos (4X)
Por isso, tudo o que eu tocar abençoado será
Tudo o que eu tocar abençoado será (3X)"
32;Fé mais fé;E;"Fé mais fé
Amor mais amor
Quem não tem, peça ao Salvador!
Pois sem fé e sem amor não pode agradar ao Senhor"
33;Há um lugar para todos;E;"Há um lugar Para Todos
Entre a família de Deus
Muito amor e felicidade
Há um lugar para Ti!

Tem alimento na mesa
Para todos comer
Muito amor e felicidade
Entre a família de Deus!

Se em tua vida lhe faltam amigos
Venha a casa de Deus
Muito amor e felicidade
Entre a família de Deus!"
34;Cristo tem poder;E;"Na Bíblia, está escrito, no Novo Testamento
Em Caná da Galiléia, Jesus foi a um casamento
Transformando água em vinho, dando ao povo pra
beber
Mostrando Sua glória, Sua graça e Seu poder

Cristo tem poder, Cristo tem poder!
Na Bíblia está escrito que é somente crer
Ele é maravilhoso e tem todo poder
Jesus Cristo é poderoso, Jesus Cristo tem poder

Jesus curou um cego entrando em Jericó
Salvou samaritana lá poço de Jacó
No monte das Oliveiras, multidões aconselhou
Com cinco pães e dois peixinhos, vinte mil alimentou

Na cidade de Naim, estava uma mulher chorando
Seu filho ia pro túmulo, e o povo carregando
Jesus parou o enterro, e o povo reprovou
Jesus chamou o morto, e o morto levantou

Jesus fez maravilhas no deserto da Judéia
Curou em Samaria e também na Galiléia
E em Cafarnaum, milagres também fez
Curou lá no caminho, dez leprosos de uma vez

Jesus fez maravilhas, está fazendo e vai fazer
Só não faz em sua vida é porque você não crê
Ele cura enfermidade dá alegria, gozo e paz
Salva os pecadores e expulsa Satanás"
35;Santo Espirito;E;"Santo Espírito enche a minha vida
Pois com Cristo eu quero brilhar
Santo Espírito enche a minha vida
Usa-me as almas a salvar
Aleluia, aleluia, Aleluia dou ao Cristo Rei
Aleluia, aleluia, Aleluia dou ao Rei"
36;Pode a tristeza durar;E;"Pode a tristeza durar até o anoitecer
Mas a alegria logo vem no amanhecer
Quero acordar cantando e louvando o meu Senhor
Quero acordar cantando e louvando o meu Senhor e Rei"
37;Estamos muito alegres;E;"Estamos muito alegres
Jesus está aqui
Sentimos muito amor
Sentimos união

Sentimos que Jesus
Está aqui em nosso meio
Por isso temos paz no coração
Sentimos que Jesus
Está aqui em nosso meio
Por isso temos paz no coração"
38;Esta casa é reservada para Deus;E;"Esta casa é reservada para Deus
Esta casa é reservada para Deus
Jamais o inimigo nela poderá tocar
Porque esta casa é reservada para Deus.

Josué foi destruir a Jericó
Mas a casa de Raabe não tocou;
Ele disse esta mulher ao Senhor se converteu
Esta casa é reservada para Deus.

Quando o crente está selado por dentro
Satanás selado fora ficará,
Quando ele bate na porta ouve algo lhe dizer
Esta casa é reservada para Deus.

Se o Espírito Santo está morando em mim
Neste mundo eu jamais terei prazer
Quando inimigo vem a me tentar eu lhe direi
Esta casa é reservada para Deus."
39;Deixa a glória de Deus brilhar;E;"Deixa a glória de Deus brilhar(5x)
Deixa a Gloria em seu rosto brilhar
Deixa a Gloria de Deus brilhar em seu rosto
Deixa a Gloria de Deus brilhar

Foi lá no cume do monte
Que o nosso Deus com Moises falava
Quando ele desceu do monte
E não sabia que seu rosto brilhava.
Brilhava brilhava o seu rosto brilhava
Foi lá no cume do monte Sinai
Que o nosso Deus com Moisés falava"
40;Jesus sim vem;E;"Jesus, sim, vem do céu, em glória Ele vem
Ecoa a nova pelo mundo além
Oh esperança que a Sua Igreja tem
Dai glória a Deus, Jesus em breve vem

Nossa esperança é Sua vinda
O Rei dos reis vem nos buscar
Nós aguardamos, Jesus, ainda
'Té a luz da manhã raiar
Nossa esperança é Sua vinda
O Rei dos reis vem nos buscar
Nós aguardamos, Jesus, ainda
'Té a luz da manhã raiar

Jesus, sim, vem, os mortos esperando estão
O gran momento da ressurreição
E do sepulcro em breve se levantarão
Dai glória a Deus, Jesus em breve vem

Jesus, sim, vem do céu cercado de esplendor
Aniquilando a corrupção e a dor
Quebrando os laços do astuto usurpador
Dai glória a Deus, Jesus em breve vem

Jesus, sim, vem, completamente restaurar
O mundo que se arruína sem parar
Sim, todas as coisas vem depressa transformar
Dai glória a Deus, Jesus em breve vem

Jesus, sim, vem, e sempiterna adoração
Daremos nós ao Rei de coração
Ao grande autor da nossa eterna salvação
Dai glória a Deus, Jesus em breve vem"
41;Vem logo doce carruagem;E;"Vem logo doce carruagem
Vem me levar ao doce lar
Vem logo doce carruagem
Vem me levar ao lar

Além do Jordão está o meu lar
Vem logo me buscar
Ali com os anjos quero morar
Vem me levar ao lar

Oh meus irmãos estais-vos prontos
Pra serem levados ao lar
Pois cristo vem logo com seus anjos
Vem nos levar ao lar"
42;Satisfação;E;"Satisfação é ter a cristo,
Não há melhor prazer já visto
Sou de Jesus, agora eu sinto
Satisfação sem fim.

Sim, paz real,
Sim, gozo na aflição
Achei o segredo
É cristo no coração,

Satisfação é nova vida,
Eu com Jesus em alegria
Sempre cantando a melodia,
Satisfação sem fim.

Satisfação é não ter medo,
Pois meu Jesus, virá bem cedo
Logo, então, eu hei de vê-lo
Satisfação sem fim"
43;Entrando no meu coração;E;"Que mudança em mim fez o meu bom Jesus
Vindo ele ao meu coração
Deu-me paz divinal, deu-me gozo e luz
Entrando no meu coração

Entrando no meu coração
Entrando no meu coração
Que mudança em mim fez o meu bom Jesus
Vindo ele ao meu coração

Eu andava perdido, Jesus me salvou
Entrando no meu coração
Meus pecados sem conta, Seu sangue lavou
Vindo ele ao meu coração

Pelo vale da morte não temo passar
Com ele no meu coração
A cidade celeste me vai transportar
O guarda do meu coração"
44;VAMOS ADORAR;;"Vamos adorar a Deus
Vamos adorar a Deus
Vamos invocar seu nome
Vamos adorar a Deus

Ele veio em minha vida, Em um dia especial
Trocou meu coração, Por um novo coração
E essa é a razão, Porque eu digo que:
Vamos adorar a Deus!"
45;Soldados somos;E;"Soldados somos de Jesus,
E campeões do bem, da luz;
Nos exércitos de Deus,
Batalhamos pelos céus.
Cantando vamos combater,
O vil pecado e seu poder.
A batalha ganha está,
A vitória Deus nos dá.

Breve vamos terminar a batalha aqui;
E pra sempre descansar com Jesus ali.
Todos os que são fiéis ao bom capitão,
Hão de receber lauréis como galardão.

Levai o escudo sim da fé,
Pois a peleja dura é,
Mas promessa temos nós,
De jamais lutarmos sós.
As flechas do mal não temer,
Mas combater até vencer,
Olham os campeões pros céus,
A vitória vem de Deus.

Se alguém cansado se encontrar,
Sem forças para pelejar;
O Senhor, quer te ajudar,
A vitória alcançar.
O mal vencendo avançai,
E hinos a Jesus cantai,
E da salvação falai;
Almas ao Senhor levai"
46;Os fiéis oravam unidos;E;"Os fieis oravam unidos
Num cenáculo ao Senhor
Quando foi do céu descido
O real consolador!

Senhor, manda já o teu poder! (3X)
E batiza cada um!

Qual um vento veemente
O poder a casa encheu
Línguas vieram sobre os crentes
Mas de fogo, lá do céu!

Noutras línguas, sim, falaram
Como Cristo concedeu
Do Espírito transbordaram
Exaltando o Rei do céu!

O poder foi prometido
Para os servos do Senhor
E pra todos concedido
Se o pedirem com fervor!"
47;Segure a imutável mão de Deus;E;"Tempos cheios de mudanças
Nada aqui sustentará
Edifique a eternidade
Segure a imutável mão de Deus

Segure a imutável mão de Deus
Segure a imutável mão de Deus
A esperança é a eternidade
Segure a imutável mão de Deus

Confie somente em Jesus Cristo
Não importa o que vier
Se os amigos abandonam
Dele mais perto quero estar

As riquezas deste mundo
Muito rápido se vão
Ganhe os tesouros eternos
Eles nunca passarão

Quando a jornada terminar
E a Deus fiel manter
Para a casa lá na gloria
A minha alma subira"
48;Fiel Amigo;E;"Cristo Jesus é fiel amigo
Ele só, Ele só
E nas fraquezas está comigo
Ele só, Ele só

E nas lutas de cada dia
Cristo nunca me deixa só
Pois Ele é meu seguro guia
Ele só, Ele só

Não há amigo mais nobre e digno
Não, não há, Não, não há
Nem mais humilde e mais benigno
Não, não há, Não, não há

Ao pecador perdoar anela
Ele só, Ele só
E pelos Seus santos sempre vela
Ele só, Ele só

Deus, em seu filho, Se há comprazido
Nele só, Nele só
Mas Sua glória me há repartido
Dele só, Dele só

Nele nós temos um firme guia
Nele só, Nele só
A noite enche de alegria
Ele só, Ele só"
49;Voarei;E;"Quando um dia desta vida terminar, eu voarei
Com meu Deus eu vou para o meu lar, eu voarei

Eu voarei
Oh Glória, eu voarei
Quando eu for
Eu darei um grande adeus
Eu voarei

Tem um lar do outro lado
Tem um lar do outro lado
Tem um lar do outro lado
Pra onde eu irei

Será um dia glorioso
Será um dia glorioso
Será um dia glorioso
Quando eu subir

Oh! Eu amo aquele homem Galileu
Que na cruz pagou os pecados meus
Ele me perdoou, um novo ser eu sou
Oh! Eu amo aquele homem Galileu

Sou feliz, por Jesus me salvar
Sou feliz, por Jesus me salvar
Se não fosse por Jesus onde estaria eu
Sou feliz, por Jesus me salvar

Meu Jesus, meu Pai, Senhor e Salvador
Ele é tudo para mim

Ele é tudo, é tudo para mim
Ele é tudo, é tudo para mim
Meu Jesus, meu Pai, Senhor e Salvador
Ele é tudo para mim

Poderoso, Amoroso é Jesus pra mim
Conselheiro, Rei da Paz, meu Deus Ele é
Me salvou, me lavou e me perdoou
Ele é maravilho para mi

Ele é tudo, é tudo para mim
Ele é tudo, é tudo para mim
Meu Jesus, meu Pai, Senhor e Salvador
Ele é tudo para mim"
50;Trabalhemos;E;"Trabalhemos, até quando Jesus voltar
Até quando Jesus voltar
Até quando Jesus voltar
E entraremos no lar

Trabalhemos, até quando Jesus voltar
Até quando Jesus voltar
Até quando Jesus voltar
E entraremos no lar"
51;Estou Seguro;E;"Que consolação tem meu coração
Descansando no poder de Deus!
Ele tem prazer em me proteger
Descansando no poder de Deus

Descansando nos eternos braços do meu Deus
Vou seguro, descansando no poder de Deus

Sempre avante vou, bem contente estou
Descansando no poder de Deus
Tudo hei de vencer pelo seu poder
Descansando no poder de Deus

Não recearei, nada temerei
Descansando no poder de Deus
Tenho paz e amor junto ao meu Senhor
Descansando no poder de Deus

Lutas sem cessar hei de atravessar
Descansando no poder de Deus
Não me deixará, mas me susterá
Descansando no poder de Deus"
52;Canta meu povo;E;"Jesus ia caminhando,
Descendo pra Jerusalém
Com Ele iam os seus discípulos
E os fariseus também
Os discípulos se alegravam
Cantavam e davam louvor
Dizendo: bendito é o rei
Que vem em nome do Senhor.

Canta meu povo, alegra meu povo
Que a festa não vai acabar.
Quando findar na terra
No céu vai continuar

Os fariseus murmuravam,
Falavam com ansiedade:
“Mande, que o povo se cale,
E não perturbe a cidade”
Jesus olhando pra eles
Falava com satisfação:
“Se eles se calarem Logo as pedras clamarão”

Nós que sabemos disto,
Que foi Jesus quem falou,
Antes que as pedras clamem
Nós clamamos ao Senhor
Jesus desceu da Sua glória
Para nos trazer salvação
Não há ninguém que tire
O gozo do meu coração."
53;Jesus é o nome;E;"Jesus é o nome, Jesus é o nome
Jesus é o nome do Senhor
Jesus é o nome, Jesus é o nome
Jesus é o nome do Senhor

Bendito é o nome, Bendito é o nome
Bendito é o nome do Senhor
Bendito é o nome, Bendito é o nome
Bendito é o nome do Senhor

Magnificai o nome, Magnificai o nome
Magnificai o nome do Senhor
Magnificai o nome, Magnificai o nome
Magnificai o nome do Senhor"
54;Quando marcharem;E;"Quando marcharem ao redor do trono,
Quando marcharem ao redor do trono,
Senhor eu quero estar naquele numero
Quando marcharem ao redor do trono

Quando o sol, escurecer,
Quando o sol escurecer
Senhor eu quero estar naquele numero
Quando o sol escurecer

Quando eu ver, os meus irmãos,
Quando eu ver, os meus irmãos,
Vou contemplar Pedro, Tiago e João
Quando eu ver os meus irmãos"
55;Quando se fizer chamada;E;"Quando Cristo sua trombeta
Lá do céu mandar tocar
Quando o dia mui glorioso lá romper
E aos remidos desta terra
Meu Jesus incorporar
E fizer-se então chamada, lá estarei

Quando se fizer chamada
Quando se fizer chamada
Quando se fizer chamada
Quando se fizer chamada, lá estarei

Nesse dia tão glorioso
Quando o crente ressurgir
E da glória de Jesus participar
Quando os crentes ressurgidos
Atingirem o porvir
E fizer-se então chamada, lá estarei

Lhe darei então pra Cristo
Até o dia terminar
Falarei do seu amor por nós aqui
Quando for findar a vida
E o lamor aqui cessar
E fizer-se então chamada, lá estarei"
56;Elias dos últimos dias;E;"Deus nos tem enviado o profeta
Prometido na bíblia sagrada
Ele veio restaurar a fé que os apóstolos pregaram
Trouxe luz para noiva de Cristo
Que ansiosa espera ao Senhor
Sua mensagem prepara o eleito e o leva ao céu

Aleluia ao nosso bom Deus
Por tão grande mensagem de amor
Que nos traz o alimento da hora
E nos livra da perdição
Obrigado querido Jesus
Por tão brilhante luz divinal
Que nos faz ver a Ti revelado de forma real

Mensageiro dos últimos dias
Foi um homem humilde e simples
Dedicado ao serviço de Deus,
Sem vaidade ensinou
Não tratou de criar controvérsias,
Sobre o vivo evangelho eternal
Simplesmente nos trouxe a luz,
Os mistérios de Deus

Este Elias nasceu numa cabana,
Nunca teve riquezas aqui
Viveu sempre ajudando os irmãos,
Cultivando o amor,
Sob o lema de somente crer
Um exemplo de fé nos deixou
Sua missão foi unir os cristãos
Pra o retorno ao céu"
57;Deus pensou o Profeta falou eu creio;E;"Tudo o que o profeta disse, com certeza eu creio
Para estar com a Palavra não há outro meio
O profeta sendo verdadeiro, é Deus em um corpo humano
Sendo ele a boca de Deus, o Profeta não comete engano
(2x)

Deus pensou o profeta falou eu creio
Deus pensou o profeta falou eu creio

Tudo o que o profeta disse, eu digo amem
Billy paul disse que estará com ele, eu estarei também
ele disse naquela manhã, eu estarei lá
E pelo meu sorriso, ali você me reconhecera (2x)

Se isto não for a verdade, eu não sei o que é
Talvez você não entenda, mas creia com fé
Creia em toda a palavra, com amor e sinceridade
Deus não tem compromisso contigo, se você crê somente
na metade (2x)"
58;Nosso Deus é maior;E;"Nosso Deus é maior
Nosso Deus é maior
E, Hoje não é diferente
Ele opera no presente
Como operou no passado

Nosso Deus é maior
Nosso Deus é maior
Não é o homem para mentir
Prometeu e vai cumprir
Se falou está falado

No passado este Deus
Sempre esteve com os seus
E os livrou de todo mal
No monte Carmelo foi assim
Quando Elias deu um fim
Nos profetas de Baal

Também não foi diferente
Quando três rapazes crentes
Confiaram nesse Deus
Sem falar naquele dia
Que Davi venceu Golias
E acabou com os Filisteus
--
Ainda hoje esse Deus
Cuida bem dos filhos teus
Na peleja vai na frente
Quebra o arco e corta a lança
Do seu povo ele é a esperança
É o socorro bem presente

Jeová é o seu nome
Ele é o fogo que consome
Na batalha é campeão
E a ninguém dá a sua glória
Nunca ouve na história
Outro Deus como esse não"
59;Obra Santa;A;"Obra santa do Espírito,
Esta causa é do Senhor,
Como vento impetuoso,
Como fogo abrasador
Estamos sobre terra santa,
Reverência e muito amor,
Esta obra é decisiva,
Vigilância e destemor.

Ninguém detém, é obra Santa.
Ninguém detém, é obra Santa
Nem Satã nem o mundo todo
Hão de apagar este ardor,
Ninguém detém, é obra Santa
Esta causa é do Senhor.

Em meu peito renovado
Arde o fogo do Senhor
É a benção do espírito
Nos enchendo do fervor
E Jesus está salvando,
Apagando toda dor
No Espírito batizando
Pois da vida Ele é o Senhor.

Eis o noivo vem chegando
Espalhando suave amor
Já se sente o perfume
Da unção do Salvador
E a noiva ataviada
De pureza e esplendor
Aguardando entrar nas bodas
Pra reinar com seu Senhor."
60;Cristo Comandante;A;"Cristo comandante sempre nos será
Na peleja santa à frente marchará
Nunca as suas hostes abandonará
Seguiremos até o fim.

Sempre avante! Manda o General
Sempre avante! Guerra contra o mal!
Firmes! Fortes! Nunca vacilar!
Com Jesus havemos de ganhar.

O pendão glorioso vamos defender
Hostes inimigas sempre combater
Nosso General o mundo há de vencer
Seguiremos a Jesus.

Na feroz batalha temos proteção
E afinal em coro junto à multidão
Entoaremos todos a real canção
Quando nós chegarmos lá."
