61;Está chegando a hora;A;"Está chegando hora, está chegando hora
Está chegando hora da igreja de Cristo ir embora
Está chegando hora, está chegando hora
Está chegando hora da igreja de Cristo ir embora

Esta igreja que aqui tanto é pisada,
É criticada e sofre tanta humilhação
Pois brevemente ela será arrebatada,
Vai embora com Jesus para Sião
Por isso nós sofremos com prazer,
Porque sabemos que está chegando a hora
De um para o outro podemos dizer,
Prepara irmão está chegando a hora

Esta igreja vai embora com Jesus,
Vai para o Céu para as Bodas do Cordeiro
E este mundo vai ficar sem a luz
E o infiel vai ficar desespero
Porque já não haverá mais livramento,
Grandes tremores que aqui jamais se viu
Porque já aconteceu o arrebatamento
E a igreja de Cristo já subiu"
62;Que maravilha é ser uma família;Em;"Que maravilha é ser uma família
Uma família em Cristo Jesus
Que maravilha é ser uma família
Uma família em Cristo Jesus
Uma família unida, uma família real
Uma família que ama, uma família sem igual
Uma família unida, uma família real
Uma família que ama, uma família sem igual"
63;Vem com Josué lutar em Jericó;Em;"Vem com Josué lutar em Jericó (Jericó, Jericó)
Vem com Josué lutar em Jericó
E as muralhas ruirão

Suba os montes devagar
Que o senhor vai guerrear
Cerquem os muros para mim
Jericó chegou ao fim

As trombetas soarão
Abalando o céu e o chão
Cerquem os muros para mim
Jericó chegou ao fim"
64;Quando o povo do Senhor adora a Deus;Em;"Quando o povo do Senhor adora a Deus
Sucedem coisas, sucedem coisas, maravilhosas
Quando o povo do Senhor adora a Deus
Sucedem coisas, sucedem coisas, maravilhosas

Então se dá libertação, e sente a sua unção (2X)
Aqui se sente a presença de Deus (2X)

Eu sinto o gozo do Espírito Santo (2X)
Eu sinto o gozo, eu sinto paz, pelo amor que Deus me dá (2X)

Jerusalém, que bonita é, ruas de ouro, mar de cristal (2X)
Por estas ruas de ouro eu andarei, ruas de ouro, mar de
cristal (2X)

Deus tem um barco que navega em alto mar,
Jesus Cristo é o Capitão (2X)

E os marinheiros que navegam ao seu lado, são aqueles que
lavaram com seu sangue o coração (2X)

Venha, Jesus te convida a navegar,
Traga suas cargas, Ele as levará (2X)

E os marinheiros que navegam ao seu lado, são aqueles que
lavaram com seu sangue o coração (2X)

Jesus vem me buscar,
Para o céu me levará,
E o Cordeiro Prometido voltará (2X)

Oh! Glória e Aleluia,
Maranata, vem Jesus,
Sou liberto pelo Sangue dá na Cruz
Vem, o Consolador, sua glória e esplendor, sou liberto pelo
Poder do Senhor

Jesus manda atento estar,
Vigiar e sempre orar,
Para o toque da trombeta escutar (2X)

Aqui se sente a presença de Deus (2X)
Eu sinto o gozo do Espírito Santo (2X)
Eu sinto o gozo, eu sinto paz, pelo amor que Deus me dá (2X)"
65;Eles vem do Leste e Oeste;C;"Eles do Leste e Oeste
Eles vem de terra de longe
Com o Rei festejar, alegremente cear
Abençoado estes peregrinos
Contemplando o seu rosto Santo
Reluzindo com o amor Divino
Bendito os portadores de sua graça
Como pedras na coroa a brilhar

Oh Jesus vem chegando logo
Nossas lutas vão ter um fim
Oh se nosso Senhor neste momento vier
Pra quem está livre do pecado
Isto então nos traria alegria
Ou tristeza e desespero
Quando o Senhor em Glória voltar
Nós o encontraremos no ar
Quando o Senhor em Glória voltar
Nós o encontraremos no ar"
66;O Pavio que fumega;D;"Não pode apagar o pavio que fumega
Jesus assopra no pavio e o fogo pega
O fogo pega, o fogo pega
Jesus assopra no pavio e o fogo pega

Quando os discípulos estavam em Jerusalém
Todo esperando o poder consolador
Foi quando veio, um vento impetuoso
Seus corações, nesta hora transbordou
E o poder, ali foi muito grande
Línguas de fogo sobre eles repousou
E os pavios que estavam apagados
Nesta hora todos eles incendiou

Esta igreja desde quando ela nasceu
Foi com fogo que Jesus inaugurou
E quando ela começa a criar cinza
É porque, o vento não assoprou
Os tições podem estar espalhados
Mas o fogo deles não se apagou
Todos aqueles que tentaram pisar neles
Se queimaram e o fogo não apagou"
67;Além da Morte;C;"Há uma terra de prazer,
Morada dos que crêem;
O dia eterno reina ali,
Tristezas nunca têm.

É primavera sempre ali,
E as flores durarão;
Alegres campos, verdes, bons,
Na linda terra estão.

Porém à entrada do País
Há um profundo mar;
Por suas águas, nós, mortais,
Havemos de passar.

Os viajantes, com temor,
À vista desse mar,
Transidos, tremem de terror
E querem recuar.

Mas o Senhor caminho abriu,
Tirou da morte o horror;
Com gozo, os salvos hão de entrar
Naquela lar de amor"
